"Pforzheim, Baden-Württemberg, Germany",NA,"Mannheim, Baden-Württemberg, Germany",NA,"Dorsten, North Rhine-Westphalia, Germany",NA,"Augsburg, Bavaria, Germany",NA,"Lüdenscheid, North Rhine-Westphalia, Germany",lidl,"Dorsten, North Rhine-Westphalia, Germany",NA,"Tuttlingen, Baden-Württemberg, Germany",NA,"Lünen, North Rhine-Westphalia, Germany",NA,"Recklinghausen, North Rhine-Westphalia, Germany",NA,"Ingolstadt, Bavaria, Germany",NA,"Gelsenkirchen, North Rhine-Westphalia, Germany",NA,"Castrop-Rauxel, North Rhine-Westphalia, Germany",NA,"Mühlacker, Baden-Württemberg, Germany",NA,"Fürth, Bavaria, Germany",NA,"Erlangen, Bavaria, Germany",NA,"Weinheim, Baden-Württemberg, Germany",NA,"Hanau, Hesse, Germany",porno,"Düren, North Rhine-Westphalia, Germany",NA,"Menden, North Rhine-Westphalia, Germany",NA,"Lage, North Rhine-Westphalia, Germany",NA,"Unterhaching, Bavaria, Germany",NA,"Salzgitter, Lower Saxony, Germany",NA,"Zwickau, Saxony, Germany",NA,"Cottbus, Brandenburg, Germany",NA,"Itzehoe, Schleswig-Holstein, Germany",NA,"Offenburg, Baden-Württemberg, Germany",NA,"Erkelenz, North Rhine-Westphalia, Germany",NA,"Bramsche, Lower Saxony, Germany",NA,"Rheine, North Rhine-Westphalia, Germany",coronavirus berlin aktuell,"Singen, Baden-Württemberg, Germany",NA,"Herne, North Rhine-Westphalia, Germany",NA,"Stade, Lower Saxony, Germany",NA,"Hilden, North Rhine-Westphalia, Germany",NA,"Albstadt, Baden-Württemberg, Germany",NA,"Castrop-Rauxel, North Rhine-Westphalia, Germany",NA,"Gelsenkirchen, North Rhine-Westphalia, Germany",NA,"Weinheim, Baden-Württemberg, Germany",NA,"Mülheim, North Rhine-Westphalia, Germany",NA,"Neunkirchen, Saarland, Germany",coronavirus kekule,"Gelsenkirchen, North Rhine-Westphalia, Germany",NA,"Fröndenberg, North Rhine-Westphalia, Germany",NA,"Nordhausen, Thuringia, Germany",NA,"Remscheid, North Rhine-Westphalia, Germany",NA,"Brühl, North Rhine-Westphalia, Germany",NA,"Iserlohn, North Rhine-Westphalia, Germany",kawasaki-syndrom,"Bottrop, North Rhine-Westphalia, Germany",NA,"Gera, Thuringia, Germany",NA,"Straubing, Bavaria, Germany",NA,"Siegburg, North Rhine-Westphalia, Germany",NA,"Lahr, Baden-Württemberg, Germany",merkel,"Ahaus, North Rhine-Westphalia, Germany",NA,"Villingen-Schwenningen, Baden-Württemberg, Germany",NA,"Forchheim, Bavaria, Germany",animal flow,"Mühlhausen, Thuringia, Germany",NA,"Frechen, North Rhine-Westphalia, Germany",NA,"Velbert, North Rhine-Westphalia, Germany",NA,"Herne, North Rhine-Westphalia, Germany",NA,"Bedburg, North Rhine-Westphalia, Germany",NA,"Remscheid, North Rhine-Westphalia, Germany",NA,"Sankt Ingbert, Saarland, Germany",coronavirus aktuell nrw,"Zwickau, Saxony, Germany",NA,"Bottrop, North Rhine-Westphalia, Germany",NA,"Ettlingen, Baden-Württemberg, Germany",NA,"Euskirchen, North Rhine-Westphalia, Germany",NA,"Dreieich, Hesse, Germany",NA,"Castrop-Rauxel, North Rhine-Westphalia, Germany",NA,"Ostfildern, Baden-Württemberg, Germany",NA,"Sundern, North Rhine-Westphalia, Germany",NA,"Kempten, Bavaria, Germany",NA,"Salzgitter, Lower Saxony, Germany",NA,"Hofheim, Hesse, Germany",NA,"Moers, North Rhine-Westphalia, Germany",NA,"Recklinghausen, North Rhine-Westphalia, Germany",NA,"Garbsen, Lower Saxony, Germany",NA,"Villingen-Schwenningen, Baden-Württemberg, Germany",NA,"Marl, North Rhine-Westphalia, Germany",NA,"Lörrach, Baden-Württemberg, Germany",NA,"Deggendorf, Bavaria, Germany",NA,"Eisenach, Thuringia, Germany",NA,"Wesel, North Rhine-Westphalia, Germany",NA,"Göttingen, Lower Saxony, Germany",NA,"Werder, Brandenburg, Germany",NA,"Remscheid, North Rhine-Westphalia, Germany",NA,"Stade, Lower Saxony, Germany",NA,"Dinslaken, North Rhine-Westphalia, Germany",NA,"Oberursel, Hesse, Germany",NA,"Brühl, North Rhine-Westphalia, Germany",NA,"Bad Münstereifel, North Rhine-Westphalia, Germany",express,"Kempen, North Rhine-Westphalia, Germany",NA,"Ibbenbüren, North Rhine-Westphalia, Germany",NA,"Ansbach, Bavaria, Germany",2 bundesliga,"Ansbach, Bavaria, Germany",2 bundesliga,"Ibbenbüren, North Rhine-Westphalia, Germany",covid,"Bad Homburg, Hesse, Germany",NA,"Dorsten, North Rhine-Westphalia, Germany",NA,"Mülheim, North Rhine-Westphalia, Germany",tönnies corona fälle,"Rodgau, Hesse, Germany",NA,"Frankfurt an der Oder, Brandenburg, Germany",NA,"Moers, North Rhine-Westphalia, Germany",coronavirus sachsen anhalt aktuell,"Delbrück, North Rhine-Westphalia, Germany",NA,"Minden, North Rhine-Westphalia, Germany",NA,"Gladbeck, North Rhine-Westphalia, Germany",NA,"Kempen, North Rhine-Westphalia, Germany",NA,"Bad Salzuflen, North Rhine-Westphalia, Germany",NA,"Neunkirchen, Saarland, Germany",NA,"Stade, Lower Saxony, Germany",NA
"Dinslaken, North Rhine-Westphalia, Germany",NA,"Witten, North Rhine-Westphalia, Germany",NA,"Kaarst, North Rhine-Westphalia, Germany",NA,"Witten, North Rhine-Westphalia, Germany",NA,"Bernau bei Berlin, Brandenburg, Germany",ard,"Seelze, Lower Saxony, Germany",NA,"Villingen-Schwenningen, Baden-Württemberg, Germany",NA,"Solingen, North Rhine-Westphalia, Germany",NA,"Nettetal, North Rhine-Westphalia, Germany",NA,"Balingen, Baden-Württemberg, Germany",NA,"Velbert, North Rhine-Westphalia, Germany",NA,"Kaarst, North Rhine-Westphalia, Germany",NA,"Ganderkesee, Lower Saxony, Germany",NA,"Mannheim, Baden-Württemberg, Germany",NA,"Kaiserslautern, Rhineland-Palatinate, Germany",NA,"Saarbrücken, Saarland, Germany",NA,"Arnsberg, North Rhine-Westphalia, Germany",zalando,"Neuwied, Rhineland-Palatinate, Germany",NA,"Leverkusen, North Rhine-Westphalia, Germany",NA,"Salzgitter, Lower Saxony, Germany",NA,"Norden, Lower Saxony, Germany",NA,"Leverkusen, North Rhine-Westphalia, Germany",NA,"Brandenburg, Brandenburg, Germany",NA,"Wermelskirchen, North Rhine-Westphalia, Germany",NA,"Böblingen, Baden-Württemberg, Germany",NA,"Stade, Lower Saxony, Germany",NA,"Moers, North Rhine-Westphalia, Germany",NA,"Bad Oeynhausen, North Rhine-Westphalia, Germany",NA,"Lehrte, Lower Saxony, Germany",coronavirus liveticker,"Düren, North Rhine-Westphalia, Germany",NA,"Velbert, North Rhine-Westphalia, Germany",NA,"Ahlen, North Rhine-Westphalia, Germany",NA,"Menden, North Rhine-Westphalia, Germany",NA,"Moers, North Rhine-Westphalia, Germany",NA,"Backnang, Baden-Württemberg, Germany",NA,"Marl, North Rhine-Westphalia, Germany",NA,"Bottrop, North Rhine-Westphalia, Germany",NA,"Moers, North Rhine-Westphalia, Germany",NA,"Gelsenkirchen, North Rhine-Westphalia, Germany",coronavirus schule nrw,"Weiden, Bavaria, Germany",NA,"Voerde, North Rhine-Westphalia, Germany",NA,"Velbert, North Rhine-Westphalia, Germany",NA,"Neuwied, Rhineland-Palatinate, Germany",NA,"Uelzen, Lower Saxony, Germany",NA,"Magdeburg, Saxony-Anhalt, Germany",joyclub,"Görlitz, Saxony, Germany",NA,"Rastatt, Baden-Württemberg, Germany",NA,"Iserlohn, North Rhine-Westphalia, Germany",NA,"Gelsenkirchen, North Rhine-Westphalia, Germany",NA,"Bergisch Gladbach, North Rhine-Westphalia, Germany",tv programm,"Neunkirchen, Saarland, Germany",NA,"Willich, North Rhine-Westphalia, Germany",NA,"Wolfenbüttel, Lower Saxony, Germany",coronavirus map deutschland,"Rottenburg, Baden-Württemberg, Germany",NA,"Brühl, North Rhine-Westphalia, Germany",NA,"Unna, North Rhine-Westphalia, Germany",NA,"Memmingen, Bavaria, Germany",NA,"Schwäbisch Hall, Baden-Württemberg, Germany",NA,"Delmenhorst, Lower Saxony, Germany",NA,"Schwäbisch Hall, Baden-Württemberg, Germany",bild de,"Weiden, Bavaria, Germany",NA,"Garbsen, Lower Saxony, Germany",NA,"Baden-Baden, Baden-Württemberg, Germany",NA,"Schwabach, Bavaria, Germany",NA,"Tübingen, Baden-Württemberg, Germany",NA,"Ibbenbüren, North Rhine-Westphalia, Germany",NA,"Oberursel, Hesse, Germany",NA,"Rüsselsheim, Hesse, Germany",NA,"Herzogenrath, North Rhine-Westphalia, Germany",NA,"Unna, North Rhine-Westphalia, Germany",NA,"Moers, North Rhine-Westphalia, Germany",NA,"Delmenhorst, Lower Saxony, Germany",NA,"Herne, North Rhine-Westphalia, Germany",NA,"Oberursel, Hesse, Germany",NA,"Gera, Thuringia, Germany",NA,"Friedrichshafen, Baden-Württemberg, Germany",NA,"Göppingen, Baden-Württemberg, Germany",NA,"Ibbenbüren, North Rhine-Westphalia, Germany",NA,"Geldern, North Rhine-Westphalia, Germany",NA,"Bocholt, North Rhine-Westphalia, Germany",NA,"Hückelhoven, North Rhine-Westphalia, Germany",NA,"Garbsen, Lower Saxony, Germany",NA,"Villingen-Schwenningen, Baden-Württemberg, Germany",NA,"Bottrop, North Rhine-Westphalia, Germany",NA,"Moers, North Rhine-Westphalia, Germany",NA,"Herne, North Rhine-Westphalia, Germany",NA,"Villingen-Schwenningen, Baden-Württemberg, Germany",NA,"Langenhagen, Lower Saxony, Germany",fussball bundesliga,"Bruchsal, Baden-Württemberg, Germany",NA,"Castrop-Rauxel, North Rhine-Westphalia, Germany",NA,"Hemer, North Rhine-Westphalia, Germany",luce douady,"Hemer, North Rhine-Westphalia, Germany",luce douady,"Mülheim, North Rhine-Westphalia, Germany",reisewarnung,"Gotha, Thuringia, Germany",NA,"Lörrach, Baden-Württemberg, Germany",NA,"Castrop-Rauxel, North Rhine-Westphalia, Germany",coronavirus bielefeld,"Velbert, North Rhine-Westphalia, Germany",NA,"Limburg, Hesse, Germany",NA,"Bühl, Baden-Württemberg, Germany",oldenburg,"Willich, North Rhine-Westphalia, Germany",NA,"Mülheim, North Rhine-Westphalia, Germany",NA,"Emsdetten, North Rhine-Westphalia, Germany",NA,"Bergheim, North Rhine-Westphalia, Germany",NA,"Göppingen, Baden-Württemberg, Germany",NA,"Herdecke, North Rhine-Westphalia, Germany",NA,"Ansbach, Bavaria, Germany",NA
"Villingen-Schwenningen, Baden-Württemberg, Germany",NA,"Laatzen, Lower Saxony, Germany",NA,"Bergkamen, North Rhine-Westphalia, Germany",NA,"Bremen, Bremen, Germany",NA,"Herne, North Rhine-Westphalia, Germany",niederlande coronavirus,"Remscheid, North Rhine-Westphalia, Germany",NA,"Erding, Bavaria, Germany",NA,"Amberg, Bavaria, Germany",NA,"Dortmund, North Rhine-Westphalia, Germany",NA,"Castrop-Rauxel, North Rhine-Westphalia, Germany",NA,"Iserlohn, North Rhine-Westphalia, Germany",NA,"Kaiserslautern, Rhineland-Palatinate, Germany",NA,"Solingen, North Rhine-Westphalia, Germany",NA,"Lahr, Baden-Württemberg, Germany",NA,"Potsdam, Brandenburg, Germany",NA,"Potsdam, Brandenburg, Germany",NA,"Lüdenscheid, North Rhine-Westphalia, Germany",web.de,"Hamelin, Lower Saxony, Germany",NA,"Teltow, Brandenburg, Germany",NA,"Gelsenkirchen, North Rhine-Westphalia, Germany",NA,"Leverkusen, North Rhine-Westphalia, Germany",NA,"Albstadt, Baden-Württemberg, Germany",NA,"Mülheim, North Rhine-Westphalia, Germany",NA,"Velbert, North Rhine-Westphalia, Germany",NA,"Gelsenkirchen, North Rhine-Westphalia, Germany",NA,"Salzgitter, Lower Saxony, Germany",NA,"Stadthagen, Lower Saxony, Germany",NA,"Neuwied, Rhineland-Palatinate, Germany",NA,"Stade, Lower Saxony, Germany",übersetzer,"Lünen, North Rhine-Westphalia, Germany",NA,"Lünen, North Rhine-Westphalia, Germany",NA,"Wolfenbüttel, Lower Saxony, Germany",NA,"Geldern, North Rhine-Westphalia, Germany",NA,"Wismar, Mecklenburg-Vorpommern, Germany",NA,"Göppingen, Baden-Württemberg, Germany",NA,"Castrop-Rauxel, North Rhine-Westphalia, Germany",NA,"Erkelenz, North Rhine-Westphalia, Germany",NA,"Wesel, North Rhine-Westphalia, Germany",NA,"Garbsen, Lower Saxony, Germany",faz online,"Mörfelden-Walldorf, Hesse, Germany",NA,"Rheine, North Rhine-Westphalia, Germany",NA,"Iserlohn, North Rhine-Westphalia, Germany",NA,"Schweinfurt, Bavaria, Germany",NA,"Dachau, Bavaria, Germany",NA,"Dreieich, Hesse, Germany",coronavirus in england,"Minden, North Rhine-Westphalia, Germany",NA,"Offenbach, Hesse, Germany",NA,"Mülheim, North Rhine-Westphalia, Germany",NA,"Villingen-Schwenningen, Baden-Württemberg, Germany",NA,"Bad Oeynhausen, North Rhine-Westphalia, Germany",coronavirus nürnberg,"Oelde, North Rhine-Westphalia, Germany",NA,"Recklinghausen, North Rhine-Westphalia, Germany",NA,"Hilden, North Rhine-Westphalia, Germany",mecklenburg vorpommern,"Mettmann, North Rhine-Westphalia, Germany",NA,"Remscheid, North Rhine-Westphalia, Germany",NA,"Fellbach, Baden-Württemberg, Germany",NA,"Ansbach, Bavaria, Germany",NA,"Winsen, Lower Saxony, Germany",NA,"Georgsmarienhütte, Lower Saxony, Germany",NA,"Unna, North Rhine-Westphalia, Germany",coronavirus live counter,"Schleswig, Schleswig-Holstein, Germany",NA,"Bünde, North Rhine-Westphalia, Germany",NA,"Frankfurt an der Oder, Brandenburg, Germany",NA,"Lippstadt, North Rhine-Westphalia, Germany",NA,"Bayreuth, Bavaria, Germany",NA,"Bensheim, Hesse, Germany",NA,"Weimar, Thuringia, Germany",NA,"Norden, Lower Saxony, Germany",NA,"Ibbenbüren, North Rhine-Westphalia, Germany",NA,"Grevenbroich, North Rhine-Westphalia, Germany",NA,"Baden-Baden, Baden-Württemberg, Germany",NA,"Velbert, North Rhine-Westphalia, Germany",NA,"Ahaus, North Rhine-Westphalia, Germany",NA,"Peine, Lower Saxony, Germany",NA,"Göttingen, Lower Saxony, Germany",NA,"Bühl, Baden-Württemberg, Germany",NA,"Oberursel, Hesse, Germany",NA,"Wesel, North Rhine-Westphalia, Germany",NA,"Mörfelden-Walldorf, Hesse, Germany",NA,"Gera, Thuringia, Germany",NA,"Marl, North Rhine-Westphalia, Germany",NA,"Gladbeck, North Rhine-Westphalia, Germany",NA,"Langen, Hesse, Germany",NA,"Mülheim, North Rhine-Westphalia, Germany",NA,"Gera, Thuringia, Germany",NA,"Bottrop, North Rhine-Westphalia, Germany",NA,"Buxtehude, Lower Saxony, Germany",NA,"Bocholt, North Rhine-Westphalia, Germany",coronavirus infizierte deutschland,"Gronau, North Rhine-Westphalia, Germany",NA,"Lünen, North Rhine-Westphalia, Germany",NA,"Leer, Lower Saxony, Germany",wie heißt die corona app,"Leer, Lower Saxony, Germany",wie heißt die corona app,"Hagen, North Rhine-Westphalia, Germany",corona virus monitor,"Mülheim, North Rhine-Westphalia, Germany",NA,"Recklinghausen, North Rhine-Westphalia, Germany",NA,"Übach-Palenberg, North Rhine-Westphalia, Germany",fernsehprogramm heute,"Steinfurt, North Rhine-Westphalia, Germany",NA,"Gelsenkirchen, North Rhine-Westphalia, Germany",NA,"Schloß Holte-Stukenbrock, North Rhine-Westphalia, Germany",aol mail,"Herford, North Rhine-Westphalia, Germany",NA,"Bottrop, North Rhine-Westphalia, Germany",NA,"Dorsten, North Rhine-Westphalia, Germany",NA,"Mörfelden-Walldorf, Hesse, Germany",NA,"Bergkamen, North Rhine-Westphalia, Germany",NA,"Bottrop, North Rhine-Westphalia, Germany",NA,"Weimar, Thuringia, Germany",NA
"Essen, North Rhine-Westphalia, Germany",NA,"Dachau, Bavaria, Germany",NA,"Böblingen, Baden-Württemberg, Germany",NA,"Mannheim, Baden-Württemberg, Germany",NA,"Hilden, North Rhine-Westphalia, Germany",spiegel online,"Böblingen, Baden-Württemberg, Germany",NA,"Neunkirchen, Saarland, Germany",NA,"Augsburg, Bavaria, Germany",NA,"Augsburg, Bavaria, Germany",NA,"Iserlohn, North Rhine-Westphalia, Germany",NA,"Darmstadt, Hesse, Germany",NA,"Lünen, North Rhine-Westphalia, Germany",NA,"Butzbach, Hesse, Germany",NA,"Speyer, Rhineland-Palatinate, Germany",NA,"Balingen, Baden-Württemberg, Germany",NA,"Augsburg, Bavaria, Germany",NA,"Nordhausen, Thuringia, Germany",media markt,"Chemnitz, Saxony, Germany",NA,"Dorsten, North Rhine-Westphalia, Germany",NA,"Melle, Lower Saxony, Germany",NA,"Lünen, North Rhine-Westphalia, Germany",NA,"Emmendingen, Baden-Württemberg, Germany",NA,"Lüdenscheid, North Rhine-Westphalia, Germany",NA,"Plauen, Saxony, Germany",NA,"Lünen, North Rhine-Westphalia, Germany",NA,"Leverkusen, North Rhine-Westphalia, Germany",NA,"Schweinfurt, Bavaria, Germany",NA,"Sankt Wendel, Saarland, Germany",NA,"Recklinghausen, North Rhine-Westphalia, Germany",dhl sendungsverfolgung,"Wesel, North Rhine-Westphalia, Germany",NA,"Bad Vilbel, Hesse, Germany",NA,"Bernau bei Berlin, Brandenburg, Germany",NA,"Goslar, Lower Saxony, Germany",NA,"Ratingen, North Rhine-Westphalia, Germany",NA,"Neumünster, Schleswig-Holstein, Germany",NA,"Leer, Lower Saxony, Germany",NA,"Nettetal, North Rhine-Westphalia, Germany",NA,"Achim, Lower Saxony, Germany",NA,"Marl, North Rhine-Westphalia, Germany",aldi online,"Bottrop, North Rhine-Westphalia, Germany",NA,"Bergisch Gladbach, North Rhine-Westphalia, Germany",NA,"Kehl, Baden-Württemberg, Germany",NA,"Düren, North Rhine-Westphalia, Germany",NA,"Gelsenkirchen, North Rhine-Westphalia, Germany",NA,"Schwäbisch Hall, Baden-Württemberg, Germany",NA,"Straubing, Bavaria, Germany",NA,"Cottbus, Brandenburg, Germany",NA,"Kaarst, North Rhine-Westphalia, Germany",NA,"Leverkusen, North Rhine-Westphalia, Germany",NA,"Willich, North Rhine-Westphalia, Germany",wetter morgen,"Velbert, North Rhine-Westphalia, Germany",NA,"Vaihingen an der Enz, Baden-Württemberg, Germany",NA,"Kempten, Bavaria, Germany",NA,"Bad Oeynhausen, North Rhine-Westphalia, Germany",NA,"Sankt Ingbert, Saarland, Germany",NA,"Gelsenkirchen, North Rhine-Westphalia, Germany",NA,"Straubing, Bavaria, Germany",NA,"Dreieich, Hesse, Germany",NA,"Bad Kissingen, Bavaria, Germany",NA,"Maintal, Hesse, Germany",coronavirus deutschland statistik,"Erlangen, Bavaria, Germany",NA,"Kaarst, North Rhine-Westphalia, Germany",NA,"Fürth, Bavaria, Germany",NA,"Hanau, Hesse, Germany",NA,"Konstanz, Baden-Württemberg, Germany",NA,"Backnang, Baden-Württemberg, Germany",NA,"Goslar, Lower Saxony, Germany",NA,"Bad Oeynhausen, North Rhine-Westphalia, Germany",NA,"Menden, North Rhine-Westphalia, Germany",NA,"Menden, North Rhine-Westphalia, Germany",NA,"Remscheid, North Rhine-Westphalia, Germany",NA,"Neu-Ulm, Bavaria, Germany",NA,"Rüsselsheim, Hesse, Germany",NA,"Senden, Bavaria, Germany",NA,"Castrop-Rauxel, North Rhine-Westphalia, Germany",NA,"Hamminkeln, North Rhine-Westphalia, Germany",NA,"Friedrichshafen, Baden-Württemberg, Germany",NA,"Hagen, North Rhine-Westphalia, Germany",NA,"Hanau, Hesse, Germany",NA,"Delmenhorst, Lower Saxony, Germany",NA,"Frankenthal, Rhineland-Palatinate, Germany",NA,"Offenbach, Hesse, Germany",NA,"Kleve, North Rhine-Westphalia, Germany",NA,"Lippstadt, North Rhine-Westphalia, Germany",NA,"Ahlen, North Rhine-Westphalia, Germany",NA,"Nottuln, North Rhine-Westphalia, Germany",NA,"Recklinghausen, North Rhine-Westphalia, Germany",NA,"Hagen, North Rhine-Westphalia, Germany",qvc,"Offenbach, Hesse, Germany",NA,"Kempen, North Rhine-Westphalia, Germany",NA,"Herzogenrath, North Rhine-Westphalia, Germany",coronavirus in duisburg,"Herzogenrath, North Rhine-Westphalia, Germany",coronavirus in duisburg,"Herford, North Rhine-Westphalia, Germany",coronavirus in münchen,"Haltern am See, North Rhine-Westphalia, Germany",NA,"Bensheim, Hesse, Germany",NA,"Recklinghausen, North Rhine-Westphalia, Germany",coronavirus brasil,"Ratingen, North Rhine-Westphalia, Germany",NA,"Brühl, North Rhine-Westphalia, Germany",NA,"Bietigheim-Bissingen, Baden-Württemberg, Germany",warendorf corona,"Singen, Baden-Württemberg, Germany",NA,"Bornheim, North Rhine-Westphalia, Germany",NA,"Herzogenrath, North Rhine-Westphalia, Germany",NA,"Ingolstadt, Bavaria, Germany",NA,"Leverkusen, North Rhine-Westphalia, Germany",NA,"Waiblingen, Baden-Württemberg, Germany",NA,"Bergisch Gladbach, North Rhine-Westphalia, Germany",NA
"Kaiserslautern, Rhineland-Palatinate, Germany",NA,"Baden-Baden, Baden-Württemberg, Germany",NA,"Lüdenscheid, North Rhine-Westphalia, Germany",NA,"Lörrach, Baden-Württemberg, Germany",NA,"Leverkusen, North Rhine-Westphalia, Germany",merkel corona,"Völklingen, Saarland, Germany",NA,"Straubing, Bavaria, Germany",NA,"Rüsselsheim, Hesse, Germany",NA,"Kaiserslautern, Rhineland-Palatinate, Germany",NA,"Berlin (Germany), ZZ-ZZZZ, ZZ",NA,"Kaiserslautern, Rhineland-Palatinate, Germany",NA,"Bruchsal, Baden-Württemberg, Germany",NA,"Arnsberg, North Rhine-Westphalia, Germany",NA,"Rüsselsheim, Hesse, Germany",NA,"Kerpen, North Rhine-Westphalia, Germany",NA,"Germering, Bavaria, Germany",NA,"Memmingen, Bavaria, Germany",lets dance,"Bottrop, North Rhine-Westphalia, Germany",NA,"Lehrte, Lower Saxony, Germany",NA,"Amberg, Bavaria, Germany",NA,"Moers, North Rhine-Westphalia, Germany",NA,"Grimma, Saxony, Germany",NA,"Wilhelmshaven, Lower Saxony, Germany",NA,"Minden, North Rhine-Westphalia, Germany",NA,"Leverkusen, North Rhine-Westphalia, Germany",NA,"Bretten, Baden-Württemberg, Germany",NA,"Lehrte, Lower Saxony, Germany",NA,"Leverkusen, North Rhine-Westphalia, Germany",NA,"Kempten, Bavaria, Germany",coronavirus deutschland tagesschau,"Wendlingen, Baden-Württemberg, Germany",NA,"Singen, Baden-Württemberg, Germany",NA,"Offenbach, Hesse, Germany",NA,"Erkelenz, North Rhine-Westphalia, Germany",NA,"Velbert, North Rhine-Westphalia, Germany",NA,"Geislingen, Baden-Württemberg, Germany",NA,"Oranienburg, Brandenburg, Germany",NA,"Düren, North Rhine-Westphalia, Germany",NA,"Ibbenbüren, North Rhine-Westphalia, Germany",NA,"Neubrandenburg, Mecklenburg-Vorpommern, Germany",bild-de,"Zwickau, Saxony, Germany",NA,"Dachau, Bavaria, Germany",NA,"Villingen-Schwenningen, Baden-Württemberg, Germany",NA,"Straubing, Bavaria, Germany",NA,"Fellbach, Baden-Württemberg, Germany",NA,"Langenhagen, Lower Saxony, Germany",NA,"Goslar, Lower Saxony, Germany",NA,"Mülheim, North Rhine-Westphalia, Germany",NA,"Bünde, North Rhine-Westphalia, Germany",NA,"Bergisch Gladbach, North Rhine-Westphalia, Germany",NA,"Cottbus, Brandenburg, Germany",koronavirus,"Bergheim, North Rhine-Westphalia, Germany",NA,"Neuwied, Rhineland-Palatinate, Germany",NA,"Kempen, North Rhine-Westphalia, Germany",NA,"Stade, Lower Saxony, Germany",NA,"Wolfenbüttel, Lower Saxony, Germany",NA,"Delmenhorst, Lower Saxony, Germany",NA,"Witten, North Rhine-Westphalia, Germany",NA,"Remscheid, North Rhine-Westphalia, Germany",NA,"Lippstadt, North Rhine-Westphalia, Germany",NA,"Wesel, North Rhine-Westphalia, Germany",fußball bundesliga,"Leverkusen, North Rhine-Westphalia, Germany",NA,"Moormerland, Lower Saxony, Germany",NA,"Hagen, North Rhine-Westphalia, Germany",NA,"Schwerte, North Rhine-Westphalia, Germany",NA,"Recklinghausen, North Rhine-Westphalia, Germany",NA,"Cottbus, Brandenburg, Germany",NA,"Mettmann, North Rhine-Westphalia, Germany",NA,"Dreieich, Hesse, Germany",NA,"Kehl, Baden-Württemberg, Germany",NA,"Cottbus, Brandenburg, Germany",NA,"Backnang, Baden-Württemberg, Germany",NA,"Bocholt, North Rhine-Westphalia, Germany",NA,"Friedrichshafen, Baden-Württemberg, Germany",NA,"Schorndorf, Baden-Württemberg, Germany",NA,"Erlangen, Bavaria, Germany",NA,"Hagen, North Rhine-Westphalia, Germany",NA,"Bramsche, Lower Saxony, Germany",NA,"Erlangen, Bavaria, Germany",NA,"Bad Oeynhausen, North Rhine-Westphalia, Germany",NA,"Euskirchen, North Rhine-Westphalia, Germany",NA,"Baden-Baden, Baden-Württemberg, Germany",NA,"Bünde, North Rhine-Westphalia, Germany",NA,"Langenfeld, North Rhine-Westphalia, Germany",NA,"Gelsenkirchen, North Rhine-Westphalia, Germany",NA,"Leonberg, Baden-Württemberg, Germany",NA,"Straubing, Bavaria, Germany",NA,"Kevelaer, North Rhine-Westphalia, Germany",NA,"Offenbach, Hesse, Germany",corona coronavirus rki,"Esslingen, Baden-Württemberg, Germany",NA,"Neusäß, Bavaria, Germany",NA,"Essen, North Rhine-Westphalia, Germany",coronavirus fallzahlen morgenpost,"Essen, North Rhine-Westphalia, Germany",coronavirus fallzahlen morgenpost,"Freising, Bavaria, Germany",blutgruppe coronavirus,"Dormagen, North Rhine-Westphalia, Germany",NA,"Filderstadt, Baden-Württemberg, Germany",NA,"Hagen, North Rhine-Westphalia, Germany",coronavirus in schweden,"Kempten, Bavaria, Germany",NA,"Villingen-Schwenningen, Baden-Württemberg, Germany",NA,"Ibbenbüren, North Rhine-Westphalia, Germany",NA,"Unna, North Rhine-Westphalia, Germany",NA,"Witten, North Rhine-Westphalia, Germany",NA,"Bünde, North Rhine-Westphalia, Germany",NA,"Erlangen, Bavaria, Germany",NA,"Erlangen, Bavaria, Germany",NA,"Kaiserslautern, Rhineland-Palatinate, Germany",NA,"Mülheim, North Rhine-Westphalia, Germany",NA
