"Bergkamen, North Rhine-Westphalia, Germany",robert koch institut coronavirus karte,"Dorsten, North Rhine-Westphalia, Germany",spring season,"Bottrop, North Rhine-Westphalia, Germany",ausgangssperre nrw,"Dorsten, North Rhine-Westphalia, Germany",promiflash,"Lünen, North Rhine-Westphalia, Germany",ebay,"Memmingen, Bavaria, Germany",NA,"Freising, Bavaria, Germany",NA,"Gelsenkirchen, North Rhine-Westphalia, Germany",NA,"Germering, Bavaria, Germany",NA,"Schwerte, North Rhine-Westphalia, Germany",usa coronavirus cases,"Weiden, Bavaria, Germany",coronavirus griechenland,"Gelsenkirchen, North Rhine-Westphalia, Germany",NA,"Oberhausen, North Rhine-Westphalia, Germany",NA,"Dorsten, North Rhine-Westphalia, Germany",NA,"Werne, North Rhine-Westphalia, Germany",NA,"Aschaffenburg, Bavaria, Germany",NA,"Iserlohn, North Rhine-Westphalia, Germany",covid-19,"Porta Westfalica, North Rhine-Westphalia, Germany",lets dance wer ist raus,"Nettetal, North Rhine-Westphalia, Germany",NA,"Offenbach, Hesse, Germany",allianz aktie,"Offenbach, Hesse, Germany",NA,"Saalfeld, Thuringia, Germany",NA,"Strausberg, Brandenburg, Germany",NA,"Iserlohn, North Rhine-Westphalia, Germany",statistics coronavirus,"Kehl, Baden-Württemberg, Germany",NA,"Herten, North Rhine-Westphalia, Germany",NA,"Marktredwitz, Bavaria, Germany",xavier naidoo,"Marl, North Rhine-Westphalia, Germany",drosten coronavirus update,"Herten, North Rhine-Westphalia, Germany",coronavirus thüringen,"Bernau bei Berlin, Brandenburg, Germany",NA,"Plauen, Saxony, Germany",NA,"Iserlohn, North Rhine-Westphalia, Germany",coronavirus england aktuell,"Bünde, North Rhine-Westphalia, Germany",coronavirus in stuttgart,"Neunkirchen, Saarland, Germany",coronavirus by country,"Ansbach, Bavaria, Germany",coronavirus reproduktionsrate,"Warendorf, North Rhine-Westphalia, Germany",coronavirus vaccine,"Iserlohn, North Rhine-Westphalia, Germany",xavier naidoo,"Warendorf, North Rhine-Westphalia, Germany",reproduktionszahl heute,"Jülich, North Rhine-Westphalia, Germany",zalando,"Görlitz, Saxony, Germany",maskenpflicht hessen,"Baden-Baden, Baden-Württemberg, Germany",NA,"Kleve, North Rhine-Westphalia, Germany",tchibo,"Gera, Thuringia, Germany",kroatien coronavirus,"Nordhausen, Thuringia, Germany",söder,"Nienburg, Lower Saxony, Germany",coronavirus china labor,"Dessau-Roßlau, Saxony-Anhalt, Germany",coronavirus moskau,"Weinstadt, Baden-Württemberg, Germany",coronavirus labor,"Castrop-Rauxel, North Rhine-Westphalia, Germany",NA,"Kehl, Baden-Württemberg, Germany",dax 30,"Bad Salzuflen, North Rhine-Westphalia, Germany",robert koch institut coronavirus zahlen,"Arnsberg, North Rhine-Westphalia, Germany",NA,"Castrop-Rauxel, North Rhine-Westphalia, Germany",nintendo switch,"Haar, Bavaria, Germany",çoronavirus,"Görlitz, Saxony, Germany",coronavirus r faktor aktuell,"Rheine, North Rhine-Westphalia, Germany",onvista,"Kaufbeuren, Bavaria, Germany",NA,"Iserlohn, North Rhine-Westphalia, Germany",zypern coronavirus,"Borken, North Rhine-Westphalia, Germany",NA,"Straubing, Bavaria, Germany",NA,"Löhne, North Rhine-Westphalia, Germany",trump news,"Weinheim, Baden-Württemberg, Germany",coronavirus argentina,"Eckernförde, Schleswig-Holstein, Germany",check24,"Unna, North Rhine-Westphalia, Germany",NA,"Lörrach, Baden-Württemberg, Germany",NA,"Einbeck, Lower Saxony, Germany",kreis borken coronavirus,"Marl, North Rhine-Westphalia, Germany",robert koch institut coronavirus fallzahlen,"Recklinghausen, North Rhine-Westphalia, Germany",wetter münchen,"Lauf an der Pegnitz, Bavaria, Germany",coronavirus duisburg,"Voerde, North Rhine-Westphalia, Germany",john tyler,"Ibbenbüren, North Rhine-Westphalia, Germany",corona virus zahlen,"Waltrop, North Rhine-Westphalia, Germany",coronavirus cases germany,"Menden, North Rhine-Westphalia, Germany",dänemark coronavirus,"Wernigerode, Saxony-Anhalt, Germany",isabel edvardsson,"Herzogenrath, North Rhine-Westphalia, Germany",world coronavirus,"Göppingen, Baden-Württemberg, Germany",cnn,"Oberhausen, North Rhine-Westphalia, Germany",coronavirus mönchengladbach,"Coburg, Bavaria, Germany",NA,"Bietigheim-Bissingen, Baden-Württemberg, Germany",coronavirus in polen,"Jülich, North Rhine-Westphalia, Germany",corona schweden,"Pinneberg, Schleswig-Holstein, Germany",coronavirus mönchengladbach,"Leinfelden-Echterdingen, Baden-Württemberg, Germany",niemcy koronawirus,"Marl, North Rhine-Westphalia, Germany",wetter hamburg,"Bad Salzuflen, North Rhine-Westphalia, Germany",paypal,"Iserlohn, North Rhine-Westphalia, Germany",NA,"Metzingen, Baden-Württemberg, Germany",coronavirus reisewarnung verlängert,"Gladbeck, North Rhine-Westphalia, Germany",coronavirus-monitor,"Gera, Thuringia, Germany",unwetterzentrale,"Stutensee, Baden-Württemberg, Germany",fc bayern gegen mönchengladbach,"Steinfurt, North Rhine-Westphalia, Germany",coronavirus kreis borken,"Herzogenrath, North Rhine-Westphalia, Germany",coronavirus aachen,"Neustadt am Rübenberge, Lower Saxony, Germany",corona virus app deutschland,"Neustadt am Rübenberge, Lower Saxony, Germany",corona virus app deutschland,"Steinfurt, North Rhine-Westphalia, Germany",kicker,"Wolfenbüttel, Lower Saxony, Germany",germania coronavirus,"Coburg, Bavaria, Germany",NA,"Herford, North Rhine-Westphalia, Germany",worldometers coronavirus,"Wiesloch, Baden-Württemberg, Germany",coronavirus deaths,"Werne, North Rhine-Westphalia, Germany",sturm der liebe,"Lippstadt, North Rhine-Westphalia, Germany",lockdown,"Iserlohn, North Rhine-Westphalia, Germany",coronavirus kinder,"Castrop-Rauxel, North Rhine-Westphalia, Germany",cnn,"Hamm, North Rhine-Westphalia, Germany",coronavirus lissabon,"Kamen, North Rhine-Westphalia, Germany",fernsehprogramm heute,"Iserlohn, North Rhine-Westphalia, Germany",coronavirus in münchen,"Germering, Bavaria, Germany",NA,"Salzgitter, Lower Saxony, Germany",hse24
"Lippstadt, North Rhine-Westphalia, Germany",merkel videobotschaft,"Nettetal, North Rhine-Westphalia, Germany",coronavirus infizierte in deutschland,"Schwerte, North Rhine-Westphalia, Germany",dashboard coronavirus,"Herne, North Rhine-Westphalia, Germany",spiegel online,"Velbert, North Rhine-Westphalia, Germany",coronavirus nrw aktuell,"Heidelberg, Baden-Württemberg, Germany",NA,"Suhl, Thuringia, Germany",NA,"Recklinghausen, North Rhine-Westphalia, Germany",NA,"Böblingen, Baden-Württemberg, Germany",NA,"Kamen, North Rhine-Westphalia, Germany",coronavirus südkorea,"Kehl, Baden-Württemberg, Germany",japan coronavirus,"Berlin (Germany), ZZ-ZZZZ, ZZ",NA,"Wolfsburg, Lower Saxony, Germany",NA,"Iserlohn, North Rhine-Westphalia, Germany",NA,"Sankt Ingbert, Saarland, Germany",NA,"Kempten, Bavaria, Germany",NA,"Hagen, North Rhine-Westphalia, Germany",news,"Villingen-Schwenningen, Baden-Württemberg, Germany",chiara d'amico,"Villingen-Schwenningen, Baden-Württemberg, Germany",NA,"Bad Salzuflen, North Rhine-Westphalia, Germany",börse,"Baden-Baden, Baden-Württemberg, Germany",NA,"Unna, North Rhine-Westphalia, Germany",NA,"Menden, North Rhine-Westphalia, Germany",NA,"Gera, Thuringia, Germany",corona münchen,"Recklinghausen, North Rhine-Westphalia, Germany",NA,"Iserlohn, North Rhine-Westphalia, Germany",NA,"Gera, Thuringia, Germany",christiane hörbiger,"Arnsberg, North Rhine-Westphalia, Germany",NA,"Löhne, North Rhine-Westphalia, Germany",coronavirus stats,"Hagen, North Rhine-Westphalia, Germany",NA,"Geldern, North Rhine-Westphalia, Germany",NA,"Waltrop, North Rhine-Westphalia, Germany",NA,"Dessau-Roßlau, Saxony-Anhalt, Germany",NA,"Oberhausen, North Rhine-Westphalia, Germany",coronavirus usa aktuell,"Neunkirchen-Seelscheid, North Rhine-Westphalia, Germany",maskenpflicht sachsen anhalt,"Schwerte, North Rhine-Westphalia, Germany",coronavirus nrw aktuell,"Hagen, North Rhine-Westphalia, Germany",fallzahlen corona,"Kehl, Baden-Württemberg, Germany",joyclub,"Herdecke, North Rhine-Westphalia, Germany",china coronavirus,"Balingen, Baden-Württemberg, Germany",jens spahn,"Unna, North Rhine-Westphalia, Germany",NA,"Moers, North Rhine-Westphalia, Germany",niederlande coronavirus,"Recklinghausen, North Rhine-Westphalia, Germany",coronavirus kita öffnung,"Siegburg, North Rhine-Westphalia, Germany",coronavirus aktuell rki,"Bottrop, North Rhine-Westphalia, Germany",coronavirus europa,"Laatzen, Lower Saxony, Germany",coronavirus reproduktionsrate aktuell,"Bottrop, North Rhine-Westphalia, Germany",shape of water,"Kempen, North Rhine-Westphalia, Germany",NA,"Stolberg (Rhineland), North Rhine-Westphalia, Germany",pressekonferenz söder,"Hagen, North Rhine-Westphalia, Germany",angela merkel coronavirus,"Moers, North Rhine-Westphalia, Germany",NA,"Kaufbeuren, Bavaria, Germany",usa coronavirus aktuell,"Olpe, North Rhine-Westphalia, Germany",attila hildmann,"Lahr, Baden-Württemberg, Germany",südtirol coronavirus,"Neu-Isenburg, Hesse, Germany",deutsche welle,"Ibbenbüren, North Rhine-Westphalia, Germany",NA,"Löhne, North Rhine-Westphalia, Germany",coronavirus tschechien,"Rheine, North Rhine-Westphalia, Germany",NA,"Wunstorf, Lower Saxony, Germany",NA,"Frechen, North Rhine-Westphalia, Germany",aktuelle zahlen coronavirus,"Bad Driburg, North Rhine-Westphalia, Germany",NA,"Löhne, North Rhine-Westphalia, Germany",ungarn coronavirus,"Herten, North Rhine-Westphalia, Germany",NA,"Dorsten, North Rhine-Westphalia, Germany",NA,"Niedernhausen, Hesse, Germany",corona virus berlin,"Gronau, North Rhine-Westphalia, Germany",coronavirus städteregion aachen,"Hagen, North Rhine-Westphalia, Germany",fc bayern gegen sge,"Rodgau, Hesse, Germany",NA,"Laatzen, Lower Saxony, Germany",israel coronavirus awareness,"Baden-Baden, Baden-Württemberg, Germany",osthessen news,"Frechen, North Rhine-Westphalia, Germany",coronavirus friesland,"Marl, North Rhine-Westphalia, Germany",coronavirus berlin bezirke,"Panketal, Brandenburg, Germany",source trump sectionbirnbaumprotocol,"Neustadt am Rübenberge, Lower Saxony, Germany",eurojackpot,"Oberhausen, North Rhine-Westphalia, Germany",frankreich coronavirus,"Haar, Bavaria, Germany",coronavirus sylt,"Stade, Lower Saxony, Germany",NA,"Rotenburg, Lower Saxony, Germany",göttingen coronavirus,"Coburg, Bavaria, Germany",mobile,"Herten, North Rhine-Westphalia, Germany",blutgruppe und coronavirus,"Lörrach, Baden-Württemberg, Germany",stefan mross,"Dorsten, North Rhine-Westphalia, Germany",coronavirus rlp,"Wilhelmshaven, Lower Saxony, Germany",coronavirus verden,"Amberg, Bavaria, Germany",NA,"Wesel, North Rhine-Westphalia, Germany",fallzahlen corona,"Speyer, Rhineland-Palatinate, Germany",drosten,"Bocholt, North Rhine-Westphalia, Germany",coronavirus aachen,"Leinfelden-Echterdingen, Baden-Württemberg, Germany",bvb,"Erlangen, Bavaria, Germany",sushant singh rajput,"Alsdorf, North Rhine-Westphalia, Germany",zauberwürfel,"Bensheim, Hesse, Germany",corona-warn-app download,"Bensheim, Hesse, Germany",corona-warn-app download,"Ansbach, Bavaria, Germany",radio gütersloh coronavirus,"Gevelsberg, North Rhine-Westphalia, Germany",coronavirus bulgarien,"Steinfurt, North Rhine-Westphalia, Germany",NA,"Emmendingen, Baden-Württemberg, Germany",coronavirus gütersloh,"Herten, North Rhine-Westphalia, Germany",aldi nord,"Salzkotten, North Rhine-Westphalia, Germany",coronavirus update drosten,"Delbrück, North Rhine-Westphalia, Germany",china coronavirus,"Fehmarn, Schleswig-Holstein, Germany",coronavirus corona,"Kevelaer, North Rhine-Westphalia, Germany",wetter köln,"Haltern am See, North Rhine-Westphalia, Germany",spanische grippe,"Herten, North Rhine-Westphalia, Germany",coronavirus corona schweden,"Herten, North Rhine-Westphalia, Germany",coronavirus reisen,"Dinslaken, North Rhine-Westphalia, Germany",NA,"Zweibrücken, Rhineland-Palatinate, Germany",NA
"Rastatt, Baden-Württemberg, Germany",coronavirus baden württemberg karte,"Göppingen, Baden-Württemberg, Germany",fallzahlen coronavirus deutschland,"Schongau, Bavaria, Germany",coronavirus china aktuell,"Schwerte, North Rhine-Westphalia, Germany",rki coronavirus fallzahlen,"Unna, North Rhine-Westphalia, Germany",t-online,"Iserlohn, North Rhine-Westphalia, Germany",NA,"Olching, Bavaria, Germany",NA,"Lahr, Baden-Württemberg, Germany",NA,"Eschborn, Hesse, Germany",NA,"Germering, Bavaria, Germany",live update coronavirus,"Landshut, Bavaria, Germany",coronavirus kreis steinfurt,"Oberhausen, North Rhine-Westphalia, Germany",NA,"Heidelberg, Baden-Württemberg, Germany",NA,"Oberhausen, North Rhine-Westphalia, Germany",NA,"Recklinghausen, North Rhine-Westphalia, Germany",NA,"Böblingen, Baden-Württemberg, Germany",NA,"Gelsenkirchen, North Rhine-Westphalia, Germany",corona aktuell,"Dessau-Roßlau, Saxony-Anhalt, Germany",tränen lügen nicht,"Garbsen, Lower Saxony, Germany",NA,"Kaufbeuren, Bavaria, Germany",коронавирус в германии 6 апреля,"Zwickau, Saxony, Germany",NA,"Blankenfelde-Mahlow, Brandenburg, Germany",NA,"Kehl, Baden-Württemberg, Germany",NA,"Lörrach, Baden-Württemberg, Germany",NA,"Lage, North Rhine-Westphalia, Germany",NA,"Gelsenkirchen, North Rhine-Westphalia, Germany",NA,"Coburg, Bavaria, Germany",NA,"Zwickau, Saxony, Germany",NA,"Dinslaken, North Rhine-Westphalia, Germany",merkel pressekonferenz,"Ganderkesee, Lower Saxony, Germany",NA,"Oranienburg, Brandenburg, Germany",NA,"Stendal, Saxony-Anhalt, Germany",NA,"Bernau bei Berlin, Brandenburg, Germany",NA,"Böblingen, Baden-Württemberg, Germany",lufthansa aktie,"Heilbad Heiligenstadt, Thuringia, Germany",deutschland,"Iserlohn, North Rhine-Westphalia, Germany",coronavirus neuigkeiten,"Menden, North Rhine-Westphalia, Germany",coronavirus neuinfektionen,"Hagen, North Rhine-Westphalia, Germany",formel 1,"Bautzen, Saxony, Germany",robert koch coronavirus,"Eisenach, Thuringia, Germany",NA,"Hilden, North Rhine-Westphalia, Germany",NA,"Schramberg, Baden-Württemberg, Germany",ausgangsbeschränkung bayern,"Königswinter, North Rhine-Westphalia, Germany",coronavirus schulen nrw,"Emsdetten, North Rhine-Westphalia, Germany",coronavirus hochzeit,"Marl, North Rhine-Westphalia, Germany",coronavirus in the world,"Marl, North Rhine-Westphalia, Germany",gov koronawirus,"Dinslaken, North Rhine-Westphalia, Germany",coronavirus deutschland fälle,"Ganderkesee, Lower Saxony, Germany",NA,"Verl, North Rhine-Westphalia, Germany",ungarn coronavirus,"Oer-Erkenschwick, North Rhine-Westphalia, Germany",impfstoffe coronavirus,"Bad Oeynhausen, North Rhine-Westphalia, Germany",NA,"Rheine, North Rhine-Westphalia, Germany",traum ferienwohnung büsum watt'n glück,"Rheine, North Rhine-Westphalia, Germany",coronavírus,"Seevetal, Lower Saxony, Germany",unwetterzentrale,"Castrop-Rauxel, North Rhine-Westphalia, Germany",entschädigung bundesliga schiedsrichter,"Moers, North Rhine-Westphalia, Germany",NA,"Arnsberg, North Rhine-Westphalia, Germany",check24,"Lage, North Rhine-Westphalia, Germany",NA,"Hagen, North Rhine-Westphalia, Germany",NA,"Castrop-Rauxel, North Rhine-Westphalia, Germany",kicker,"Ibbenbüren, North Rhine-Westphalia, Germany",NA,"Kornwestheim, Baden-Württemberg, Germany",inka bause bauer sucht frau,"Stade, Lower Saxony, Germany",NA,"Hagen, North Rhine-Westphalia, Germany",NA,"Ansbach, Bavaria, Germany",ungarn coronavirus,"Erlangen, Bavaria, Germany",NA,"Kempten, Bavaria, Germany",corona hessen,"Oberhausen, North Rhine-Westphalia, Germany",NA,"Recklinghausen, North Rhine-Westphalia, Germany",coronavirus update ndr,"Bietigheim-Bissingen, Baden-Württemberg, Germany",renate krößner,"Oberhausen, North Rhine-Westphalia, Germany",2 liga,"Maintal, Hesse, Germany",fitnessstudios coronavirus berlin,"Baden-Baden, Baden-Württemberg, Germany",onetz trauer,"Marl, North Rhine-Westphalia, Germany",göttingen corona,"Kempten, Bavaria, Germany",coronavirus meter,"Norden, Lower Saxony, Germany",berlin,"Velbert, North Rhine-Westphalia, Germany",NA,"Oberhausen, North Rhine-Westphalia, Germany",coronavirus fälle weltweit,"Arnsberg, North Rhine-Westphalia, Germany",kindergeld bonus,"Wesseling, North Rhine-Westphalia, Germany",spanien coronavirus,"Ibbenbüren, North Rhine-Westphalia, Germany",coronavirus app,"Bad Salzuflen, North Rhine-Westphalia, Germany",coronavirus in schweden,"Albstadt, Baden-Württemberg, Germany",coronavirus oldenburg,"Castrop-Rauxel, North Rhine-Westphalia, Germany",NA,"Eschweiler, North Rhine-Westphalia, Germany",kindergeld bonus,"Albstadt, Baden-Württemberg, Germany",coronavirus lockerungen,"Bad Oeynhausen, North Rhine-Westphalia, Germany",bild.de,"Bad Salzungen, Thuringia, Germany",regenradar,"Herten, North Rhine-Westphalia, Germany",coronavirus mutiert,"Dorsten, North Rhine-Westphalia, Germany",sweden coronavirus,"Schwerte, North Rhine-Westphalia, Germany",werder bremen gegen fc bayern,"Schwerte, North Rhine-Westphalia, Germany",werder bremen gegen fc bayern,"Arnsberg, North Rhine-Westphalia, Germany",echtzeitkarte coronavirus,"Singen, Baden-Württemberg, Germany",coronavirus aktuell zahlen,"Kamen, North Rhine-Westphalia, Germany",NA,"Wertheim am Main, Baden-Württemberg, Germany",fallzahlen coronavirus,"Uelzen, Lower Saxony, Germany",coronavirus israel,"Uelzen, Lower Saxony, Germany",coronavirus inkubationszeit,"Oberhausen, North Rhine-Westphalia, Germany",maps,"Haltern am See, North Rhine-Westphalia, Germany",coronavirus in europa,"Kamp-Lintfort, North Rhine-Westphalia, Germany",coronavirus in moers,"Delmenhorst, Lower Saxony, Germany",NA,"Lohmar, North Rhine-Westphalia, Germany",rki coronavirus fallzahlen,"Beckum, North Rhine-Westphalia, Germany",schweiz coronavirus,"Wesel, North Rhine-Westphalia, Germany",NA,"Bietigheim-Bissingen, Baden-Württemberg, Germany",NA
"Hagen, North Rhine-Westphalia, Germany",coronavirus interaktive karte,"Heidelberg, Baden-Württemberg, Germany",coronavirus italy,"Warstein, North Rhine-Westphalia, Germany",coronavirus nrw zahlen,"Bergkamen, North Rhine-Westphalia, Germany",coronavirus niedersachsen aktuell,"Hagen, North Rhine-Westphalia, Germany",coronavirus merkel,"Schwerte, North Rhine-Westphalia, Germany",NA,"Geretsried, Bavaria, Germany",NA,"Dorsten, North Rhine-Westphalia, Germany",NA,"Kempten, Bavaria, Germany",NA,"Weiden, Bavaria, Germany",NA,"Wiesloch, Baden-Württemberg, Germany",liveticker coronavirus,"Mülheim, North Rhine-Westphalia, Germany",NA,"Krefeld, North Rhine-Westphalia, Germany",NA,"Heidelberg, Baden-Württemberg, Germany",NA,"Frankfurt an der Oder, Brandenburg, Germany",NA,"Müllheim, Baden-Württemberg, Germany",NA,"Hemer, North Rhine-Westphalia, Germany",rki,"Marl, North Rhine-Westphalia, Germany",verstehen sie spaß,"Halberstadt, Saxony-Anhalt, Germany",NA,"Kleve, North Rhine-Westphalia, Germany",boris johnson corona,"Verden, Lower Saxony, Germany",NA,"Offenbach, Hesse, Germany",NA,"Schwerte, North Rhine-Westphalia, Germany",NA,"Bad Krozingen, Baden-Württemberg, Germany",NA,"Iserlohn, North Rhine-Westphalia, Germany",NA,"Cuxhaven, Lower Saxony, Germany",NA,"Arnsberg, North Rhine-Westphalia, Germany",NA,"Unna, North Rhine-Westphalia, Germany",NA,"Velbert, North Rhine-Westphalia, Germany",tagesschau,"Velbert, North Rhine-Westphalia, Germany",NA,"Herten, North Rhine-Westphalia, Germany",NA,"Herten, North Rhine-Westphalia, Germany",NA,"Velbert, North Rhine-Westphalia, Germany",NA,"Lage, North Rhine-Westphalia, Germany",christine lambrecht,"Wiesloch, Baden-Württemberg, Germany",schutzmasken,"Bünde, North Rhine-Westphalia, Germany",drosten podcast,"Lörrach, Baden-Württemberg, Germany",corona fallzahlen,"Memmingen, Bavaria, Germany",singapur coronavirus,"Hagen, North Rhine-Westphalia, Germany",österreich coronavirus,"Kempen, North Rhine-Westphalia, Germany",NA,"Lahr, Baden-Württemberg, Germany",NA,"Gera, Thuringia, Germany",coronavirus fallzahlen weltweit,"Castrop-Rauxel, North Rhine-Westphalia, Germany",auswärtiges amt reisewarnung corona,"Lippstadt, North Rhine-Westphalia, Germany",laschet,"Recklinghausen, North Rhine-Westphalia, Germany",türkei coronavirus,"Amberg, Bavaria, Germany",NA,"Dorsten, North Rhine-Westphalia, Germany",zeeland coronavirus,"Stolberg (Rhineland), North Rhine-Westphalia, Germany",NA,"Dinslaken, North Rhine-Westphalia, Germany",kinder coronavirus,"Eschweiler, North Rhine-Westphalia, Germany",coronavirus schule,"Ratingen, North Rhine-Westphalia, Germany",NA,"Viernheim, Hesse, Germany",NA,"Coburg, Bavaria, Germany",usa,"Weiden, Bavaria, Germany",bitcoin,"Lindau, Bavaria, Germany",NA,"Borken, North Rhine-Westphalia, Germany",NA,"Pinneberg, Schleswig-Holstein, Germany",NA,"Straubing, Bavaria, Germany",NA,"Lengerich, North Rhine-Westphalia, Germany",NA,"Pinneberg, Schleswig-Holstein, Germany",fernsehprogramm,"Eschweiler, North Rhine-Westphalia, Germany",NA,"Ibbenbüren, North Rhine-Westphalia, Germany",koronavírus németország,"Hanau, Hesse, Germany",NA,"Recklinghausen, North Rhine-Westphalia, Germany",NA,"Zweibrücken, Rhineland-Palatinate, Germany",polska koronawirus,"Bad Oeynhausen, North Rhine-Westphalia, Germany",NA,"Marl, North Rhine-Westphalia, Germany",thüringen,"Kaufbeuren, Bavaria, Germany",NA,"Gladbeck, North Rhine-Westphalia, Germany",ozon,"Recklinghausen, North Rhine-Westphalia, Germany",coronavirus baptisten,"Lahr, Baden-Württemberg, Germany",NA,"Langenhagen, Lower Saxony, Germany",NA,"Geesthacht, Schleswig-Holstein, Germany",NA,"Overath, North Rhine-Westphalia, Germany",corona virus aktuell,"Löhne, North Rhine-Westphalia, Germany",coronavirus in italia,"Weiden, Bavaria, Germany",германия коронавирус,"Ahlen, North Rhine-Westphalia, Germany",NA,"Gladbeck, North Rhine-Westphalia, Germany",regenradar,"Syke, Lower Saxony, Germany",coronavirus radar,"Bad Oldesloe, Schleswig-Holstein, Germany",thüringen coronavirus,"Stralsund, Mecklenburg-Vorpommern, Germany",coronavirus mecklenburg vorpommern,"Hemer, North Rhine-Westphalia, Germany",trump coronavirus,"Laatzen, Lower Saxony, Germany",virus corona,"Lörrach, Baden-Württemberg, Germany",NA,"Arnsberg, North Rhine-Westphalia, Germany",3 liga,"Ibbenbüren, North Rhine-Westphalia, Germany",погода,"Herten, North Rhine-Westphalia, Germany",john hopkins coronavirus,"Herten, North Rhine-Westphalia, Germany",kicker,"Frechen, North Rhine-Westphalia, Germany",drosten,"Leinfelden-Echterdingen, Baden-Württemberg, Germany",elo zahl,"Jülich, North Rhine-Westphalia, Germany",coronavirus app rki,"Jülich, North Rhine-Westphalia, Germany",coronavirus app rki,"Coburg, Bavaria, Germany",coronavirus großveranstaltungen,"Ansbach, Bavaria, Germany",coronavirus tracker,"Marl, North Rhine-Westphalia, Germany",NA,"Schloß Holte-Stukenbrock, North Rhine-Westphalia, Germany",coronavirus in berlin,"Hagen, North Rhine-Westphalia, Germany",coronavirus italien aktuell,"Wesel, North Rhine-Westphalia, Germany",NA,"Castrop-Rauxel, North Rhine-Westphalia, Germany",germania coronavirus,"Pinneberg, Schleswig-Holstein, Germany",coronavirus slowenien,"Rheda-Wiedenbrück, North Rhine-Westphalia, Germany",kroatien corona,"Castrop-Rauxel, North Rhine-Westphalia, Germany",NA,"Castrop-Rauxel, North Rhine-Westphalia, Germany",kreis borken coronavirus,"Gronau, North Rhine-Westphalia, Germany",sport1,"Edewecht, Lower Saxony, Germany",NA,"Wesel, North Rhine-Westphalia, Germany",NA
