2020-03-18  City,2020-03-18  Trending,2020-03-19  City,2020-03-19  Trending,2020-03-20  City,2020-03-20  Trending,2020-03-21  City,2020-03-21  Trending,2020-03-22  City,2020-03-22  Trending,2020-03-23  City,2020-03-23  Trending,2020-03-24  City,2020-03-24  Trending,2020-03-25  City,2020-03-25  Trending,2020-03-26  City,2020-03-26  Trending,2020-03-27  City,2020-03-27  Trending,2020-03-28  City,2020-03-28  Trending,2020-03-29  City,2020-03-29  Trending,2020-03-30  City,2020-03-30  Trending,2020-03-31  City,2020-03-31  Trending,2020-04-01  City,2020-04-01  Trending,2020-04-02  City,2020-04-02  Trending,2020-04-03  City,2020-04-03  Trending,2020-04-04  City,2020-04-04  Trending,2020-04-05  City,2020-04-05  Trending,2020-04-06  City,2020-04-06  Trending,2020-04-07  City,2020-04-07  Trending,2020-04-08  City,2020-04-08  Trending,2020-04-09  City,2020-04-09  Trending,2020-04-10  City,2020-04-10  Trending,2020-04-11  City,2020-04-11  Trending,2020-04-12  City,2020-04-12  Trending,2020-04-13  City,2020-04-13  Trending,2020-04-14  City,2020-04-14  Trending,2020-04-15  City,2020-04-15  Trending,2020-04-16  City,2020-04-16  Trending,2020-04-17  City,2020-04-17  Trending,2020-04-18  City,2020-04-18  Trending,2020-04-19  City,2020-04-19  Trending,2020-04-20  City,2020-04-20  Trending,2020-04-21  City,2020-04-21  Trending,2020-04-22  City,2020-04-22  Trending,2020-04-23  City,2020-04-23  Trending,2020-04-24  City,2020-04-24  Trending,2020-04-25  City,2020-04-25  Trending,2020-04-26  City,2020-04-26  Trending,2020-04-27  City,2020-04-27  Trending,2020-04-28  City,2020-04-28  Trending,2020-04-29  City,2020-04-29  Trending,2020-04-30  City,2020-04-30  Trending,2020-05-01  City,2020-05-01  Trending,2020-05-02  City,2020-05-02  Trending,2020-05-03  City,2020-05-03  Trending,2020-05-04  City,2020-05-04  Trending,2020-05-05  City,2020-05-05  Trending,2020-05-06  City,2020-05-06  Trending,2020-05-07  City,2020-05-07  Trending,2020-05-08  City,2020-05-08  Trending,2020-05-09  City,2020-05-09  Trending,2020-05-10  City,2020-05-10  Trending,2020-05-11  City,2020-05-11  Trending,2020-05-12  City,2020-05-12  Trending,2020-05-13  City,2020-05-13  Trending,2020-05-14  City,2020-05-14  Trending,2020-05-15  City,2020-05-15  Trending,2020-05-16  City,2020-05-16  Trending,2020-05-17  City,2020-05-17  Trending,2020-05-18  City,2020-05-18  Trending,2020-05-19  City,2020-05-19  Trending,2020-05-20  City,2020-05-20  Trending,2020-05-21  City,2020-05-21  Trending,2020-05-22  City,2020-05-22  Trending,2020-05-23  City,2020-05-23  Trending,2020-05-24  City,2020-05-24  Trending,2020-05-25  City,2020-05-25  Trending,2020-05-26  City,2020-05-26  Trending,2020-05-27  City,2020-05-27  Trending,2020-05-28  City,2020-05-28  Trending,2020-05-29  City,2020-05-29  Trending,2020-05-30  City,2020-05-30  Trending,2020-05-31  City,2020-05-31  Trending,2020-06-01  City,2020-06-01  Trending,2020-06-02  City,2020-06-02  Trending,2020-06-03  City,2020-06-03  Trending,2020-06-04  City,2020-06-04  Trending,2020-06-05  City,2020-06-05  Trending,2020-06-06  City,2020-06-06  Trending,2020-06-07  City,2020-06-07  Trending,2020-06-08  City,2020-06-08  Trending,2020-06-09  City,2020-06-09  Trending,2020-06-10  City,2020-06-10  Trending,2020-06-11  City,2020-06-11  Trending,2020-06-12  City,2020-06-12  Trending,2020-06-13  City,2020-06-13  Trending,2020-06-14  City,2020-06-14  Trending,2020-06-15  City,2020-06-15  Trending,2020-06-16  City,2020-06-16  Trending,2020-06-16  City,2020-06-16  Trending,2020-06-17  City,2020-06-17  Trending,2020-06-18  City,2020-06-18  Trending,2020-06-19  City,2020-06-19  Trending,2020-06-20  City,2020-06-20  Trending,2020-06-21  City,2020-06-21  Trending,2020-06-22  City,2020-06-22  Trending,2020-06-23  City,2020-06-23  Trending,2020-06-24  City,2020-06-24  Trending,2020-06-25  City,2020-06-25  Trending,2020-06-26  City,2020-06-26  Trending,2020-06-27  City,2020-06-27  Trending,2020-06-28  City,2020-06-28  Trending,2020-06-29  City,2020-06-29  Trending,2020-06-30  City,2020-06-30  Trending
"Kleve, North Rhine-Westphalia, Germany",coronavirus news,"Kaufbeuren, Bavaria, Germany",coronavirus nrw,"Kaufbeuren, Bavaria, Germany",coronavirus bayern,"Kaufbeuren, Bavaria, Germany",coronavirus aktuell,"Geilenkirchen, North Rhine-Westphalia, Germany",coronavirus tipps,"Unna, North Rhine-Westphalia, Germany",dax,"Kaufbeuren, Bavaria, Germany",banh mi,"Datteln, North Rhine-Westphalia, Germany",prinz charles,"Fröndenberg, North Rhine-Westphalia, Germany",aktuelle zahlen coronavirus,"Kaufbeuren, Bavaria, Germany",coronavirus usa,"Kaufbeuren, Bavaria, Germany",coronavirus tipps,"Kaufbeuren, Bavaria, Germany",coronavirus tips,"Datteln, North Rhine-Westphalia, Germany",dax,"Kaufbeuren, Bavaria, Germany",koronawirus porady,"Kaufbeuren, Bavaria, Germany",andrew jack,"Datteln, North Rhine-Westphalia, Germany",wetter,"Zwickau, Saxony, Germany",coronavirus,"Geestland, Lower Saxony, Germany",coronavirus niedersachsen,"Gladbeck, North Rhine-Westphalia, Germany",dsds,"Schönebeck, Saxony-Anhalt, Germany",boris johnson,"Walsrode, Lower Saxony, Germany",boris johnson,"Dessau-Roßlau, Saxony-Anhalt, Germany",coronavirus afrika,"Schönebeck, Saxony-Anhalt, Germany",فيروس كورونا,"Kaufbeuren, Bavaria, Germany",fernsehprogramm heute,"Seelze, Lower Saxony, Germany",coronavirus türkei,"Bad Saulgau, Baden-Württemberg, Germany",frohe ostern,"Stendal, Saxony-Anhalt, Germany",coronavirus china,"Oer-Erkenschwick, North Rhine-Westphalia, Germany",coronavirus schule,"Bad Harzburg, Lower Saxony, Germany",coronavirus,"Gera, Thuringia, Germany",coronavirus stats,"Weißenfels, Saxony-Anhalt, Germany",coronavirus china,"Halberstadt, Saxony-Anhalt, Germany",eurojackpot,"Halberstadt, Saxony-Anhalt, Germany",corona deutschland,"Gotha, Thuringia, Germany",coronavirus stats,"Wernigerode, Saxony-Anhalt, Germany",coronavirus sachsen anhalt,"Gevelsberg, North Rhine-Westphalia, Germany",maskenpflicht nrw,"Wittenberg, Saxony-Anhalt, Germany",robert koch institut coronavirus,"Oer-Erkenschwick, North Rhine-Westphalia, Germany",norbert blüm,"Salzwedel, Saxony-Anhalt, Germany",coronavirus masken,"Wernigerode, Saxony-Anhalt, Germany",kim jong un,"Gladbeck, North Rhine-Westphalia, Germany",dax,"Gladbeck, North Rhine-Westphalia, Germany",coronavirus germania,"Gladbeck, North Rhine-Westphalia, Germany",schweden coronavirus,"Bad Friedrichshall, Baden-Württemberg, Germany",angela merkel coronavirus,"Oer-Erkenschwick, North Rhine-Westphalia, Germany",tag der arbeit,"Vreden, North Rhine-Westphalia, Germany",coronavirus tips,"Voerde, North Rhine-Westphalia, Germany",reproduktionszahl coronavirus,"Oberhausen, North Rhine-Westphalia, Germany",fitnessstudios coronavirus,"Hattingen, North Rhine-Westphalia, Germany",коронавирус,"Rheinfelden, Baden-Württemberg, Germany",fitnessstudios coronavirus,"Oberhausen, North Rhine-Westphalia, Germany",coronavirus kinder kawasaki syndrom,"Gladbeck, North Rhine-Westphalia, Germany",lockerungen coronavirus,"Coesfeld, North Rhine-Westphalia, Germany",roy horn,"Schöppingen, North Rhine-Westphalia, Germany",reproduktionszahl coronavirus rki,"Oer-Erkenschwick, North Rhine-Westphalia, Germany",reproduktionszahl coronavirus rki,"Gladbeck, North Rhine-Westphalia, Germany",nachrichten aktuell coronavirus,"Gladbeck, North Rhine-Westphalia, Germany",coronavirus china,"Oer-Erkenschwick, North Rhine-Westphalia, Germany",reproduktionszahl coronavirus rki,"Oer-Erkenschwick, North Rhine-Westphalia, Germany",bundesliga,"Wegberg, North Rhine-Westphalia, Germany",bundesliga,"Geesthacht, Schleswig-Holstein, Germany",heinsberg coronavirus,"Datteln, North Rhine-Westphalia, Germany",coronavirus corona rki fallzahlen,"Rheinberg, North Rhine-Westphalia, Germany",coronavirus r zahl aktuell,"Neuried, Baden-Württemberg, Germany",coronavirus corona,"Vreden, North Rhine-Westphalia, Germany",vatertag,"Vreden, North Rhine-Westphalia, Germany",dax,"Leer, Lower Saxony, Germany",bundesliga,"Moormerland, Lower Saxony, Germany",coronavirus nachrichten,"Moormerland, Lower Saxony, Germany",nachrichten deutschland coronavirus,"Kerken, North Rhine-Westphalia, Germany",bundesliga,"Moormerland, Lower Saxony, Germany",wetter,"Leer, Lower Saxony, Germany",wetter,"Vreden, North Rhine-Westphalia, Germany",coronavirus dänemark,"Jühnde, Lower Saxony, Germany",bundesliga,"Unterschleißheim, Bavaria, Germany",superspreader coronavirus,"Durmersheim, Baden-Württemberg, Germany",kindertag,"Horb am Neckar, Baden-Württemberg, Germany",wetter morgen,"Jühnde, Lower Saxony, Germany",konjunkturpaket,"Vreden, North Rhine-Westphalia, Germany",rki fallzahlen coronavirus,"Gauting, Bavaria, Germany",schweden coronavirus,"Vreden, North Rhine-Westphalia, Germany",blutgruppen coronavirus,"Duderstadt, Lower Saxony, Germany",kinderbonus coronavirus,"Heilbad Heiligenstadt, Thuringia, Germany",rki fallzahlen coronavirus,"Oer-Erkenschwick, North Rhine-Westphalia, Germany",coronavirus thüringen,"Backnang, Baden-Württemberg, Germany",worldometers coronavirus,"Blaustein, Baden-Württemberg, Germany",coronavirus italien,"Römerberg-Dudenhofen, Rhineland-Palatinate, Germany",kinderbonus coronavirus,"Gauting, Bavaria, Germany",bundesliga,"Horb am Neckar, Baden-Württemberg, Germany",coronavirus china,"Magdeburg, Saxony-Anhalt, Germany",corona app,"Vreden, North Rhine-Westphalia, Germany",coronavirus,"Vreden, North Rhine-Westphalia, Germany",coronavirus,"Rheda-Wiedenbrück, North Rhine-Westphalia, Germany",coronavirus nrw,"Rheda-Wiedenbrück, North Rhine-Westphalia, Germany",coronavirus italien,"Sassenberg, North Rhine-Westphalia, Germany",wirecard,"Oelde, North Rhine-Westphalia, Germany",sommer,"Oelde, North Rhine-Westphalia, Germany",stuttgart,"Rheda-Wiedenbrück, North Rhine-Westphalia, Germany",tönnies coronavirus,"Wadersloh, North Rhine-Westphalia, Germany",coronavirus update,"Enger, North Rhine-Westphalia, Germany",usa coronavirus,"Moers, North Rhine-Westphalia, Germany",wirecard,"Moers, North Rhine-Westphalia, Germany",coronavirus corona,"Vreden, North Rhine-Westphalia, Germany",bundesliga,"Unterschleißheim, Bavaria, Germany",2. bundesliga,"Ganderkesee, Lower Saxony, Germany",coronavirus münchen,"Bad Hersfeld, Hesse, Germany",marsha p. johnson
"Unna, North Rhine-Westphalia, Germany",coronavirus monitor,"Ansbach, Bavaria, Germany",coronavirus bayern,"Ansbach, Bavaria, Germany",robert koch institut coronavirus,"Tuttlingen, Baden-Württemberg, Germany",corona aktuell,"Gera, Thuringia, Germany",coronavirus aktuell,"Ansbach, Bavaria, Germany",usa coronavirus,"Offenbach, Hesse, Germany",corona deutschland,"Kaufbeuren, Bavaria, Germany",russland coronavirus,"Offenbach, Hesse, Germany",coronavirus zahlen weltweit,"Datteln, North Rhine-Westphalia, Germany",usa coronavirus,"Gevelsberg, North Rhine-Westphalia, Germany",coronavirus deutschland aktuell,"Marl, North Rhine-Westphalia, Germany",thomas schäfer,"Marl, North Rhine-Westphalia, Germany",john hopkins coronavirus,"Datteln, North Rhine-Westphalia, Germany",coronavirus new york,"Laatzen, Lower Saxony, Germany",aktuelle zahlen coronavirus deutschland,"Ansbach, Bavaria, Germany",koronawirus,"Wittenberg, Saxony-Anhalt, Germany",coronavirus tipps,"Zwickau, Saxony, Germany",lets dance,"Deggendorf, Bavaria, Germany",dsds gewinner,"Gera, Thuringia, Germany",dax,"Ochtrup, North Rhine-Westphalia, Germany",coronavirus krätzemittel,"Laatzen, Lower Saxony, Germany",فيروس كورونا,"Gladbeck, North Rhine-Westphalia, Germany",coronavirus rechtsmediziner,"Deggendorf, Bavaria, Germany",italien coronavirus,"Herten, North Rhine-Westphalia, Germany",türkei coronavirus,"Nordenham, Lower Saxony, Germany",ostern,"Oberhausen, North Rhine-Westphalia, Germany",coronavirus schule,"Neuruppin, Brandenburg, Germany",dax,"Dülmen, North Rhine-Westphalia, Germany",coronavirus deutschland,"Oberhausen, North Rhine-Westphalia, Germany",usa coronavirus,"Oer-Erkenschwick, North Rhine-Westphalia, Germany",china coronavirus,"Schönebeck, Saxony-Anhalt, Germany",lets dance,"Neuruppin, Brandenburg, Germany",rki coronavirus,"Gera, Thuringia, Germany",corona aktuell,"Geesthacht, Schleswig-Holstein, Germany",berlin coronavirus,"Oer-Erkenschwick, North Rhine-Westphalia, Germany",maskenpflicht,"Gera, Thuringia, Germany",nikotin coronavirus,"Wittenberg, Saxony-Anhalt, Germany",trump,"Neuruppin, Brandenburg, Germany",drosten coronavirus,"Gladbeck, North Rhine-Westphalia, Germany",italien coronavirus,"Stendal, Saxony-Anhalt, Germany",coronavirus schule,"Stadtlohn, North Rhine-Westphalia, Germany",coronavirus österreich,"Burladingen, Baden-Württemberg, Germany",tasuku honjo coronavirus,"Gevelsberg, North Rhine-Westphalia, Germany",tasuku honjo coronavirus,"Senftenberg, Brandenburg, Germany",coronavirus labor wuhan,"Leichlingen, North Rhine-Westphalia, Germany",rki coronavirus fallzahlen,"Oberhausen, North Rhine-Westphalia, Germany",schweden coronavirus aktuell,"Geesthacht, Schleswig-Holstein, Germany",coronavirus fitnessstudios,"Gladbeck, North Rhine-Westphalia, Germany",koronawirus,"Hattingen, North Rhine-Westphalia, Germany",coronavirus berlin,"Gladbeck, North Rhine-Westphalia, Germany",bodo wartke coronavirus,"Oer-Erkenschwick, North Rhine-Westphalia, Germany",militärweltspiele wuhan coronavirus,"Oer-Erkenschwick, North Rhine-Westphalia, Germany",nachrichten coronavirus,"Sangerhausen, Saxony-Anhalt, Germany",robert koch institut coronavirus,"Halberstadt, Saxony-Anhalt, Germany",tomris uyar,"Gera, Thuringia, Germany",kawasaki syndrom,"Bautzen, Saxony, Germany",coronavirus reproduktionszahl,"Sondershausen, Thuringia, Germany",robert koch institut coronavirus zahlen,"Datteln, North Rhine-Westphalia, Germany",coronavirus r faktor aktuell,"Vreden, North Rhine-Westphalia, Germany",coronavirus fallzahlen deutschland,"Stendal, Saxony-Anhalt, Germany",coronavirus nachrichten,"Gladbeck, North Rhine-Westphalia, Germany",dax,"Gardelegen, Saxony-Anhalt, Germany",coronavirus impfstoffe,"Neu-Isenburg, Hesse, Germany",israel kamakawiwoʻole,"Haar, Bavaria, Germany",coronavirus vatertag,"Coburg, Bavaria, Germany",fallzahlen deutschland coronavirus,"Espelkamp, North Rhine-Westphalia, Germany",coronavirus thüringen,"Rhauderfehn, Lower Saxony, Germany",brasilien coronavirus,"Leer, Lower Saxony, Germany",dax,"Herzogenaurach, Bavaria, Germany",coronavirus spanien,"Vreden, North Rhine-Westphalia, Germany",coronavirus drosten,"Voerde, North Rhine-Westphalia, Germany",коронавирус,"Sonthofen, Bavaria, Germany",superspreader coronavirus,"Uelzen, Lower Saxony, Germany",superspreader coronavirus,"Herten, North Rhine-Westphalia, Germany",usa,"Vreden, North Rhine-Westphalia, Germany",coronavirus robert koch institut,"Butzbach, Hesse, Germany",dax,"Vreden, North Rhine-Westphalia, Germany",coronavirus familienbonus,"Herten, North Rhine-Westphalia, Germany",george floyd,"Neu-Isenburg, Hesse, Germany",blutgruppen coronavirus,"Langenhagen, Lower Saxony, Germany",coronavirus blutgruppen,"Florstadt, Hesse, Germany",coronavirus numbers,"Vreden, North Rhine-Westphalia, Germany",coronavirus spanien,"Neu-Isenburg, Hesse, Germany",reproduktionszahl coronavirus,"Weinstadt, Baden-Württemberg, Germany",dfb pokal,"Schönebeck, Saxony-Anhalt, Germany",corona news,"Unterschleißheim, Bavaria, Germany",coronavirus schweden,"Vreden, North Rhine-Westphalia, Germany",coronavirus impfstoff,"Vreden, North Rhine-Westphalia, Germany",coronavirus peking,"Dietzenbach, Hesse, Germany",coronavirus app,"Magdeburg, Saxony-Anhalt, Germany",corona app,"Magdeburg, Saxony-Anhalt, Germany",corona app,"Vreden, North Rhine-Westphalia, Germany",bundesliga,"Oelde, North Rhine-Westphalia, Germany",germany coronavirus,"Rheda-Wiedenbrück, North Rhine-Westphalia, Germany",coronavirus kassel,"Rheda-Wiedenbrück, North Rhine-Westphalia, Germany",coronavirus zahlen,"Bad Salzuflen, North Rhine-Westphalia, Germany",coronavirus hamm,"Hamm, North Rhine-Westphalia, Germany",dax,"Ahlen, North Rhine-Westphalia, Germany",gütersloh,"Lübbecke, North Rhine-Westphalia, Germany",coronavirus kroatien,"Espelkamp, North Rhine-Westphalia, Germany",coronavirus großbritannien,"Neu-Isenburg, Hesse, Germany",coronavirus kreis wesel,"Unterschleißheim, Bavaria, Germany",corona aktuell,"Neutraubling, Bavaria, Germany",hsv,"Neukirchen-Vluyn, North Rhine-Westphalia, Germany",dax,"Gevelsberg, North Rhine-Westphalia, Germany",corona coronavirus
"Marl, North Rhine-Westphalia, Germany",china coronavirus,"Marl, North Rhine-Westphalia, Germany",frühling,"Crailsheim, Baden-Württemberg, Germany",coronavirus sachsen,"Bottrop, North Rhine-Westphalia, Germany",impfstoff coronavirus,"Oberhausen, North Rhine-Westphalia, Germany",bild,"Datteln, North Rhine-Westphalia, Germany",dow jones,"Kleve, North Rhine-Westphalia, Germany",usa coronavirus,"Unna, North Rhine-Westphalia, Germany",coronavirus italien aktuelle zahlen,"Kleve, North Rhine-Westphalia, Germany",johns hopkins corona,"Deggendorf, Bavaria, Germany",till lindemann,"Offenbach, Hesse, Germany",wetter,"Offenbach, Hesse, Germany",klaus wowereit,"Kamen, North Rhine-Westphalia, Germany",bayern coronavirus,"Offenbach, Hesse, Germany",schweden coronavirus,"Berlin (Germany), ZZ-ZZZZ, ZZ",new york coronavirus,"Hattingen, North Rhine-Westphalia, Germany",коронавирус,"Gera, Thuringia, Germany",coronavirus tips,"Gera, Thuringia, Germany",coronavirus frankreich,"Georgsmarienhütte, Lower Saxony, Germany",lidl,"Eisenach, Thuringia, Germany",coronavirus österreich,"Gevelsberg, North Rhine-Westphalia, Germany",coronavirus frankreich,"Gladbeck, North Rhine-Westphalia, Germany",who,"Dessau-Roßlau, Saxony-Anhalt, Germany",coronavirus verdopplungszeit,"Baden-Baden, Baden-Württemberg, Germany",tv programm,"Ansbach, Bavaria, Germany",schweden coronavirus,"Laatzen, Lower Saxony, Germany",fernsehprogramm heute,"Dorsten, North Rhine-Westphalia, Germany",leopoldina,"Schwedt, Brandenburg, Germany",österreich coronavirus,"Wittenberg, Saxony-Anhalt, Germany",coronavirus aktuell,"Gladbeck, North Rhine-Westphalia, Germany",france coronavirus,"Neuruppin, Brandenburg, Germany",italien coronavirus,"Baunatal, Hesse, Germany",coronavirus afrika,"Gladbeck, North Rhine-Westphalia, Germany",robert koch institut coronavirus,"Riesa, Saxony, Germany",dax,"Dessau-Roßlau, Saxony-Anhalt, Germany",maskenpflicht baden württemberg,"Schönebeck, Saxony-Anhalt, Germany",coronavirus maskenpflicht,"Schwedt, Brandenburg, Germany",raucher coronavirus,"Arnsberg, North Rhine-Westphalia, Germany",coronavirus tips,"Eberswalde, Brandenburg, Germany",robert koch institut coronavirus,"Albstadt, Baden-Württemberg, Germany",coronavirus impfstoff,"Datteln, North Rhine-Westphalia, Germany",masken coronavirus,"Lahr, Baden-Württemberg, Germany",rki dashboard coronavirus,"Iserlohn, North Rhine-Westphalia, Germany",reisewarnung verlängerung,"Gladbeck, North Rhine-Westphalia, Germany",coronavirus angela merkel,"Attendorn, North Rhine-Westphalia, Germany",kawasaki syndrom,"Castrop-Rauxel, North Rhine-Westphalia, Germany",coronavirus sachsen anhalt,"Arnsberg, North Rhine-Westphalia, Germany",fitnessstudios coronavirus,"Hattingen, North Rhine-Westphalia, Germany",dax,"Nordhausen, Thuringia, Germany",usa coronavirus,"Oberhausen, North Rhine-Westphalia, Germany",coronavirus nrw,"Marl, North Rhine-Westphalia, Germany",lockerungen coronavirus,"Marl, North Rhine-Westphalia, Germany",coesfeld,"Gera, Thuringia, Germany",siegfried und roy,"Coburg, Bavaria, Germany",coronavirus robert koch institut,"Schönebeck, Saxony-Anhalt, Germany",dax,"Stendal, Saxony-Anhalt, Germany",coronavirus update ndr,"Steinfurt, North Rhine-Westphalia, Germany",coronavirus brasilien,"Hofgeismar, Hesse, Germany",coronavirus kinder,"Stendal, Saxony-Anhalt, Germany",famotidin,"Coburg, Bavaria, Germany",coronavirus schweden,"Datteln, North Rhine-Westphalia, Germany",fallzahlen deutschland coronavirus,"Gera, Thuringia, Germany",coronavirus r zahl aktuell,"Datteln, North Rhine-Westphalia, Germany",coronavirus update ndr,"Oer-Erkenschwick, North Rhine-Westphalia, Germany",coronavirus impfung,"Jülich, North Rhine-Westphalia, Germany",berlin coronavirus,"Moormerland, Lower Saxony, Germany",bundesliga,"Emsdetten, North Rhine-Westphalia, Germany",lets dance,"Dillingen, Saarland, Germany",leer coronavirus,"Leichlingen, North Rhine-Westphalia, Germany",robert koch institut coronavirus zahlen,"Lengerich, North Rhine-Westphalia, Germany",coronavirus sachsen anhalt,"Leer, Lower Saxony, Germany",trump coronavirus,"Iserlohn, North Rhine-Westphalia, Germany",coronavirus china,"Dorsten, North Rhine-Westphalia, Germany",coronavirus österreich,"Weil am Rhein, Baden-Württemberg, Germany",coronavirus kreis kleve,"Moormerland, Lower Saxony, Germany",italien coronavirus,"Westoverledingen, Lower Saxony, Germany",sonneberg coronavirus,"Überlingen, Baden-Württemberg, Germany",coronavirus neuinfektionen rki,"Zeuthen, Brandenburg, Germany",coronavirus konjunkturpaket,"Marl, North Rhine-Westphalia, Germany",kreis borken coronavirus,"Taufkirchen, Bavaria, Germany",coronavirus blutgruppen,"Hemer, North Rhine-Westphalia, Germany",bundesliga,"Neu-Isenburg, Hesse, Germany",koronawirus polska,"Duderstadt, Lower Saxony, Germany",coronavirus göttingen,"Riedstadt, Hesse, Germany",coronavirus update ndr,"Herzogenrath, North Rhine-Westphalia, Germany",coronavirus dortmund,"Horb am Neckar, Baden-Württemberg, Germany",coronavirus corona,"Halberstadt, Saxony-Anhalt, Germany",wetter morgen,"Neu-Isenburg, Hesse, Germany",rki coronavirus,"Leinfelden-Echterdingen, Baden-Württemberg, Germany",worldometers coronavirus,"Oer-Erkenschwick, North Rhine-Westphalia, Germany",dax,"Uelzen, Lower Saxony, Germany",corona warn app,"Uelzen, Lower Saxony, Germany",corona warn app,"County of Rietberg, North Rhine-Westphalia, Germany",coronavirus germania,"Magdeburg, Saxony-Anhalt, Germany",coronavirus germania,"Bad Wildungen, Hesse, Germany",coronavirus verden,"Verl, North Rhine-Westphalia, Germany",коронавирус,"Steinhagen, North Rhine-Westphalia, Germany",stuttgart news,"Vreden, North Rhine-Westphalia, Germany",wirecard aktie,"Beckum, North Rhine-Westphalia, Germany",corona aktuell,"Wadersloh, North Rhine-Westphalia, Germany",worldometers coronavirus,"Hagen, North Rhine-Westphalia, Germany",lufthansa,"Bückeburg, Lower Saxony, Germany",coronavirus düsseldorf,"Oelde, North Rhine-Westphalia, Germany",coronavirus fallzahlen,"Horb am Neckar, Baden-Württemberg, Germany",2 bundesliga,"Neu-Isenburg, Hesse, Germany",wirecard aktie,"Voerde, North Rhine-Westphalia, Germany",coronavirus corona
