"Hamm, North Rhine-Westphalia, Germany",NA,"Löhne, North Rhine-Westphalia, Germany",NA,"Gütersloh, North Rhine-Westphalia, Germany",NA,"Konstanz, Baden-Württemberg, Germany",NA,"Langenfeld, North Rhine-Westphalia, Germany",NA,"Lünen, North Rhine-Westphalia, Germany",NA,"Hanau, Hesse, Germany",NA,"Moers, North Rhine-Westphalia, Germany",NA,"Pforzheim, Baden-Württemberg, Germany",NA,"Konstanz, Baden-Württemberg, Germany",NA,"Leverkusen, North Rhine-Westphalia, Germany",NA,"Gütersloh, North Rhine-Westphalia, Germany",NA,"Paderborn, North Rhine-Westphalia, Germany",NA,"Gelsenkirchen, North Rhine-Westphalia, Germany",NA,"Schwäbisch Hall, Baden-Württemberg, Germany",NA,"Bottrop, North Rhine-Westphalia, Germany",NA,"Gütersloh, North Rhine-Westphalia, Germany",yahoo,"Bad Mergentheim, Baden-Württemberg, Germany",NA,"Springe, Lower Saxony, Germany",NA,"Hildesheim, Lower Saxony, Germany",NA,"Königs Wusterhausen, Brandenburg, Germany",NA,"Kleve, North Rhine-Westphalia, Germany",NA,"Bad Oeynhausen, North Rhine-Westphalia, Germany",NA,"Bergisch Gladbach, North Rhine-Westphalia, Germany",NA,"Castrop-Rauxel, North Rhine-Westphalia, Germany",NA,"Hamelin, Lower Saxony, Germany",NA,"Pforzheim, Baden-Württemberg, Germany",NA,"Hamelin, Lower Saxony, Germany",NA,"Viersen, North Rhine-Westphalia, Germany",ard,"Hamm, North Rhine-Westphalia, Germany",NA,"Delmenhorst, Lower Saxony, Germany",NA,"Herne, North Rhine-Westphalia, Germany",NA,"Bochum, North Rhine-Westphalia, Germany",NA,"Mülheim, North Rhine-Westphalia, Germany",NA,"Bad Salzuflen, North Rhine-Westphalia, Germany",NA,"Böblingen, Baden-Württemberg, Germany",NA,"Lüdenscheid, North Rhine-Westphalia, Germany",NA,"Monheim am Rhein, North Rhine-Westphalia, Germany",NA,"Salzgitter, Lower Saxony, Germany",NA,"Sindelfingen, Baden-Württemberg, Germany",NA,"Straubing, Bavaria, Germany",NA,"Solingen, North Rhine-Westphalia, Germany",NA,"Cuxhaven, Lower Saxony, Germany",NA,"Berlin (Germany), ZZ-ZZZZ, ZZ",NA,"Heilbronn, Baden-Württemberg, Germany",NA,"Coburg, Bavaria, Germany",NA,"Garbsen, Lower Saxony, Germany",NA,"Remscheid, North Rhine-Westphalia, Germany",NA,"Marl, North Rhine-Westphalia, Germany",NA,"Duisburg, North Rhine-Westphalia, Germany",kekule coronavirus,"Elmshorn, Schleswig-Holstein, Germany",NA,"Bruchsal, Baden-Württemberg, Germany",NA,"Dachau, Bavaria, Germany",NA,"Leer, Lower Saxony, Germany",NA,"Langenhagen, Lower Saxony, Germany",NA,"Worms, Rhineland-Palatinate, Germany",NA,"Herford, North Rhine-Westphalia, Germany",NA,"Worms, Rhineland-Palatinate, Germany",NA,"Herford, North Rhine-Westphalia, Germany",NA,"Kempten, Bavaria, Germany",NA,"Magdeburg, Saxony-Anhalt, Germany",NA,"Böblingen, Baden-Württemberg, Germany",NA,"Germering, Bavaria, Germany",NA,"Speyer, Rhineland-Palatinate, Germany",NA,"Aalen, Baden-Württemberg, Germany",NA,"Euskirchen, North Rhine-Westphalia, Germany",NA,"Düsseldorf, North Rhine-Westphalia, Germany",NA,"Voerde, North Rhine-Westphalia, Germany",NA,"Siegburg, North Rhine-Westphalia, Germany",NA,"Plauen, Saxony, Germany",NA,"Ratingen, North Rhine-Westphalia, Germany",NA,"Kamp-Lintfort, North Rhine-Westphalia, Germany",NA,"Bocholt, North Rhine-Westphalia, Germany",NA,"Melle, Lower Saxony, Germany",NA,"Lahr, Baden-Württemberg, Germany",NA,"Ratingen, North Rhine-Westphalia, Germany",NA,"Kaarst, North Rhine-Westphalia, Germany",NA,"Remscheid, North Rhine-Westphalia, Germany",NA,"Rüsselsheim, Hesse, Germany",NA,"Freising, Bavaria, Germany",NA,"Euskirchen, North Rhine-Westphalia, Germany",NA,"Tuttlingen, Baden-Württemberg, Germany",NA,"Dormagen, North Rhine-Westphalia, Germany",NA,"Neuwied, Rhineland-Palatinate, Germany",NA,"Kaiserslautern, Rhineland-Palatinate, Germany",NA,"Konstanz, Baden-Württemberg, Germany",NA,"Aschaffenburg, Bavaria, Germany",NA,"Berlin (Germany), ZZ-ZZZZ, ZZ",NA,"Crailsheim, Baden-Württemberg, Germany",NA,"Bünde, North Rhine-Westphalia, Germany",NA,"Remscheid, North Rhine-Westphalia, Germany",NA,"Remscheid, North Rhine-Westphalia, Germany",NA,"Kaufbeuren, Bavaria, Germany",NA,"Erlangen, Bavaria, Germany",NA,"Varel, Lower Saxony, Germany",NA,"Langen, Hesse, Germany",johns hopkins coronavirus map,"Niederkassel, North Rhine-Westphalia, Germany",NA,"Lünen, North Rhine-Westphalia, Germany",NA,"Ratingen, North Rhine-Westphalia, Germany",NA,"Lüdenscheid, North Rhine-Westphalia, Germany",NA,"Duisburg, North Rhine-Westphalia, Germany",NA,"Bietigheim-Bissingen, Baden-Württemberg, Germany",NA,"Kaiserslautern, Rhineland-Palatinate, Germany",NA,"Bergheim, North Rhine-Westphalia, Germany",NA,"Friedrichshafen, Baden-Württemberg, Germany",NA,"Heilbronn, Baden-Württemberg, Germany",NA
"Rüsselsheim, Hesse, Germany",NA,"Gütersloh, North Rhine-Westphalia, Germany",NA,"Langen, Hesse, Germany",NA,"Pforzheim, Baden-Württemberg, Germany",NA,"Speyer, Rhineland-Palatinate, Germany",NA,"Wolfsburg, Lower Saxony, Germany",NA,"Munich, Bavaria, Germany",NA,"Passau, Bavaria, Germany",NA,"Würselen, North Rhine-Westphalia, Germany",NA,"Munich, Bavaria, Germany",NA,"Wiesbaden, Hesse, Germany",NA,"Wetzlar, Hesse, Germany",NA,"Worms, Rhineland-Palatinate, Germany",NA,"Darmstadt, Hesse, Germany",NA,"Friedrichshafen, Baden-Württemberg, Germany",NA,"Reutlingen, Baden-Württemberg, Germany",NA,"Delmenhorst, Lower Saxony, Germany",corona-virus,"Bocholt, North Rhine-Westphalia, Germany",NA,"Amberg, Bavaria, Germany",NA,"Aschaffenburg, Bavaria, Germany",NA,"Greven, North Rhine-Westphalia, Germany",NA,"Gummersbach, North Rhine-Westphalia, Germany",NA,"Minden, North Rhine-Westphalia, Germany",NA,"Wolfsburg, Lower Saxony, Germany",NA,"Villingen-Schwenningen, Baden-Württemberg, Germany",NA,"Menden, North Rhine-Westphalia, Germany",NA,"Rheine, North Rhine-Westphalia, Germany",NA,"Melle, Lower Saxony, Germany",NA,"Hilden, North Rhine-Westphalia, Germany",merkel corona,"Lemgo, North Rhine-Westphalia, Germany",NA,"Mülheim, North Rhine-Westphalia, Germany",NA,"Bergisch Gladbach, North Rhine-Westphalia, Germany",NA,"Biberach, Baden-Württemberg, Germany",NA,"Wilhelmshaven, Lower Saxony, Germany",NA,"Schwabach, Bavaria, Germany",NA,"Ratingen, North Rhine-Westphalia, Germany",NA,"Herford, North Rhine-Westphalia, Germany",NA,"Bad Oeynhausen, North Rhine-Westphalia, Germany",NA,"Brandenburg, Brandenburg, Germany",NA,"Schwabach, Bavaria, Germany",NA,"Düren, North Rhine-Westphalia, Germany",NA,"Homburg, Saarland, Germany",NA,"Herne, North Rhine-Westphalia, Germany",NA,"Freital, Saxony, Germany",NA,"Garbsen, Lower Saxony, Germany",NA,"Wunstorf, Lower Saxony, Germany",NA,"Lüdenscheid, North Rhine-Westphalia, Germany",NA,"Freising, Bavaria, Germany",NA,"Menden, North Rhine-Westphalia, Germany",NA,"Offenbach, Hesse, Germany",frankreich coronavirus,"Witten, North Rhine-Westphalia, Germany",NA,"Ibbenbüren, North Rhine-Westphalia, Germany",NA,"Königswinter, North Rhine-Westphalia, Germany",NA,"Barsinghausen, Lower Saxony, Germany",NA,"Bruchsal, Baden-Württemberg, Germany",NA,"Wilhelmshaven, Lower Saxony, Germany",NA,"Pulheim, North Rhine-Westphalia, Germany",NA,"Aschaffenburg, Bavaria, Germany",NA,"Magdeburg, Saxony-Anhalt, Germany",NA,"Gelsenkirchen, North Rhine-Westphalia, Germany",NA,"Wilhelmshaven, Lower Saxony, Germany",NA,"Erding, Bavaria, Germany",NA,"Rastatt, Baden-Württemberg, Germany",NA,"Witten, North Rhine-Westphalia, Germany",NA,"Mülheim, North Rhine-Westphalia, Germany",NA,"Bruchsal, Baden-Württemberg, Germany",NA,"Herne, North Rhine-Westphalia, Germany",NA,"Weimar, Thuringia, Germany",NA,"Bayreuth, Bavaria, Germany",NA,"Nettetal, North Rhine-Westphalia, Germany",NA,"Konstanz, Baden-Württemberg, Germany",NA,"Erding, Bavaria, Germany",NA,"Castrop-Rauxel, North Rhine-Westphalia, Germany",NA,"Koblenz, Rhineland-Palatinate, Germany",NA,"Beckum, North Rhine-Westphalia, Germany",NA,"Hanau, Hesse, Germany",NA,"Bottrop, North Rhine-Westphalia, Germany",NA,"Rheine, North Rhine-Westphalia, Germany",NA,"Velbert, North Rhine-Westphalia, Germany",NA,"Rastatt, Baden-Württemberg, Germany",NA,"Bad Salzuflen, North Rhine-Westphalia, Germany",NA,"Bürstadt, Hesse, Germany",NA,"Esslingen, Baden-Württemberg, Germany",NA,"Euskirchen, North Rhine-Westphalia, Germany",NA,"Herne, North Rhine-Westphalia, Germany",NA,"Magdeburg, Saxony-Anhalt, Germany",NA,"Rüsselsheim, Hesse, Germany",NA,"Düsseldorf, North Rhine-Westphalia, Germany",NA,"Goslar, Lower Saxony, Germany",NA,"Rüsselsheim, Hesse, Germany",NA,"Heidenheim, Baden-Württemberg, Germany",NA,"Heidenheim, Baden-Württemberg, Germany",NA,"Salzgitter, Lower Saxony, Germany",NA,"Moers, North Rhine-Westphalia, Germany",NA,"Remscheid, North Rhine-Westphalia, Germany",NA,"Celle, Lower Saxony, Germany",usa news,"Berlin (Germany), ZZ-ZZZZ, ZZ",NA,"Eschweiler, North Rhine-Westphalia, Germany",NA,"Hann. Münden, Lower Saxony, Germany",NA,"Leinfelden-Echterdingen, Baden-Württemberg, Germany",NA,"Salzgitter, Lower Saxony, Germany",NA,"Solingen, North Rhine-Westphalia, Germany",NA,"Delmenhorst, Lower Saxony, Germany",NA,"Rastatt, Baden-Württemberg, Germany",NA,"Offenbach, Hesse, Germany",NA,"Rüsselsheim, Hesse, Germany",NA
"Alsdorf, North Rhine-Westphalia, Germany",NA,"Ingolstadt, Bavaria, Germany",NA,"Heilbronn, Baden-Württemberg, Germany",NA,"Neunkirchen, Saarland, Germany",NA,"Coesfeld, North Rhine-Westphalia, Germany",NA,"Ingolstadt, Bavaria, Germany",NA,"Nuremberg, Bavaria, Germany",NA,"Neuss, North Rhine-Westphalia, Germany",NA,"Stade, Lower Saxony, Germany",NA,"Darmstadt, Hesse, Germany",NA,"Bamberg, Bavaria, Germany",NA,"Hamm, North Rhine-Westphalia, Germany",NA,"Langenfeld, North Rhine-Westphalia, Germany",NA,"Bühl, Baden-Württemberg, Germany",NA,"Bruchsal, Baden-Württemberg, Germany",NA,"Ludwigshafen, Rhineland-Palatinate, Germany",NA,"Hamm, North Rhine-Westphalia, Germany",zdf mediathek,"Hanau, Hesse, Germany",NA,"Wismar, Mecklenburg-Vorpommern, Germany",NA,"Chemnitz, Saxony, Germany",NA,"Offenburg, Baden-Württemberg, Germany",NA,"Remscheid, North Rhine-Westphalia, Germany",NA,"Alsdorf, North Rhine-Westphalia, Germany",NA,"Erlangen, Bavaria, Germany",NA,"Sindelfingen, Baden-Württemberg, Germany",NA,"Schwerin, Mecklenburg-Vorpommern, Germany",NA,"Bremerhaven, Bremen, Germany",NA,"Pforzheim, Baden-Württemberg, Germany",NA,"Mülheim, North Rhine-Westphalia, Germany",coronavirus kindergarten,"Salzgitter, Lower Saxony, Germany",NA,"Peine, Lower Saxony, Germany",NA,"Minden, North Rhine-Westphalia, Germany",NA,"Celle, Lower Saxony, Germany",NA,"Weimar, Thuringia, Germany",NA,"Bergheim, North Rhine-Westphalia, Germany",NA,"Neumünster, Schleswig-Holstein, Germany",NA,"Solingen, North Rhine-Westphalia, Germany",NA,"Offenbach, Hesse, Germany",NA,"Cuxhaven, Lower Saxony, Germany",NA,"Frechen, North Rhine-Westphalia, Germany",NA,"Kaarst, North Rhine-Westphalia, Germany",NA,"Lemgo, North Rhine-Westphalia, Germany",NA,"Minden, North Rhine-Westphalia, Germany",NA,"Weiden, Bavaria, Germany",NA,"Willich, North Rhine-Westphalia, Germany",NA,"Gronau, North Rhine-Westphalia, Germany",NA,"Rüsselsheim, Hesse, Germany",NA,"Herne, North Rhine-Westphalia, Germany",NA,"Herne, North Rhine-Westphalia, Germany",NA,"Schorndorf, Baden-Württemberg, Germany",schule nrw,"Lemgo, North Rhine-Westphalia, Germany",NA,"Friedrichshafen, Baden-Württemberg, Germany",NA,"Sindelfingen, Baden-Württemberg, Germany",NA,"Gütersloh, North Rhine-Westphalia, Germany",NA,"Meerbusch, North Rhine-Westphalia, Germany",NA,"Bietigheim-Bissingen, Baden-Württemberg, Germany",NA,"Bornheim, North Rhine-Westphalia, Germany",NA,"Brühl, North Rhine-Westphalia, Germany",NA,"Hofheim, Hesse, Germany",NA,"Borken, North Rhine-Westphalia, Germany",NA,"Wunstorf, Lower Saxony, Germany",NA,"Cottbus, Brandenburg, Germany",NA,"Hamm, North Rhine-Westphalia, Germany",NA,"Bad Homburg, Hesse, Germany",NA,"Germering, Bavaria, Germany",NA,"Plauen, Saxony, Germany",NA,"Offenburg, Baden-Württemberg, Germany",NA,"Dachau, Bavaria, Germany",NA,"Bensheim, Hesse, Germany",NA,"Frankenthal, Rhineland-Palatinate, Germany",NA,"Langenhagen, Lower Saxony, Germany",NA,"Hürth, North Rhine-Westphalia, Germany",NA,"Dülmen, North Rhine-Westphalia, Germany",NA,"Greven, North Rhine-Westphalia, Germany",NA,"Neuwied, Rhineland-Palatinate, Germany",NA,"Hückelhoven, North Rhine-Westphalia, Germany",NA,"Bochum, North Rhine-Westphalia, Germany",NA,"Neuwied, Rhineland-Palatinate, Germany",NA,"Aschaffenburg, Bavaria, Germany",NA,"Göttingen, Lower Saxony, Germany",NA,"Augsburg, Bavaria, Germany",NA,"Magdeburg, Saxony-Anhalt, Germany",NA,"Dreieich, Hesse, Germany",NA,"Vaihingen an der Enz, Baden-Württemberg, Germany",NA,"Bottrop, North Rhine-Westphalia, Germany",NA,"Aschaffenburg, Bavaria, Germany",NA,"Kaiserslautern, Rhineland-Palatinate, Germany",NA,"Göttingen, Lower Saxony, Germany",NA,"Ulm, Baden-Württemberg, Germany",NA,"Menden, North Rhine-Westphalia, Germany",NA,"Oberursel, Hesse, Germany",NA,"Oberursel, Hesse, Germany",NA,"Landshut, Bavaria, Germany",NA,"Velbert, North Rhine-Westphalia, Germany",NA,"Tuttlingen, Baden-Württemberg, Germany",NA,"Ibbenbüren, North Rhine-Westphalia, Germany",coronavirus südafrika,"Hanau, Hesse, Germany",NA,"Sankt Wendel, Saarland, Germany",NA,"Brandenburg, Brandenburg, Germany",NA,"Kaufbeuren, Bavaria, Germany",NA,"Bensheim, Hesse, Germany",NA,"Düren, North Rhine-Westphalia, Germany",NA,"Villingen-Schwenningen, Baden-Württemberg, Germany",NA,"Dinslaken, North Rhine-Westphalia, Germany",NA,"Velbert, North Rhine-Westphalia, Germany",NA,"Langen, Hesse, Germany",NA
"Esslingen, Baden-Württemberg, Germany",NA,"Heilbronn, Baden-Württemberg, Germany",NA,"Munich, Bavaria, Germany",NA,"Darmstadt, Hesse, Germany",NA,"Kempten, Bavaria, Germany",NA,"Pforzheim, Baden-Württemberg, Germany",NA,"Traunreut, Bavaria, Germany",NA,"Darmstadt, Hesse, Germany",NA,"Ludwigshafen, Rhineland-Palatinate, Germany",NA,"Hamm, North Rhine-Westphalia, Germany",NA,"Erkelenz, North Rhine-Westphalia, Germany",NA,"Konstanz, Baden-Württemberg, Germany",NA,"Villingen-Schwenningen, Baden-Württemberg, Germany",NA,"Reutlingen, Baden-Württemberg, Germany",NA,"Gelsenkirchen, North Rhine-Westphalia, Germany",NA,"Munich, Bavaria, Germany",NA,"Amberg, Bavaria, Germany",dhl tracking,"Bietigheim-Bissingen, Baden-Württemberg, Germany",NA,"Hanau, Hesse, Germany",NA,"Euskirchen, North Rhine-Westphalia, Germany",NA,"Hamm, North Rhine-Westphalia, Germany",NA,"Worms, Rhineland-Palatinate, Germany",NA,"Aschaffenburg, Bavaria, Germany",NA,"Castrop-Rauxel, North Rhine-Westphalia, Germany",NA,"Bremen, Bremen, Germany",NA,"Bergisch Gladbach, North Rhine-Westphalia, Germany",NA,"Landshut, Bavaria, Germany",NA,"Hanau, Hesse, Germany",NA,"Schwerin, Mecklenburg-Vorpommern, Germany",coronavirus friseur,"Siegen, North Rhine-Westphalia, Germany",NA,"Offenbach, Hesse, Germany",NA,"Worms, Rhineland-Palatinate, Germany",NA,"Kempten, Bavaria, Germany",NA,"Salzgitter, Lower Saxony, Germany",NA,"Minden, North Rhine-Westphalia, Germany",NA,"Leverkusen, North Rhine-Westphalia, Germany",NA,"Kleve, North Rhine-Westphalia, Germany",NA,"Lippstadt, North Rhine-Westphalia, Germany",NA,"Minden, North Rhine-Westphalia, Germany",NA,"Villingen-Schwenningen, Baden-Württemberg, Germany",NA,"Viernheim, Hesse, Germany",NA,"Ettlingen, Baden-Württemberg, Germany",NA,"Ratingen, North Rhine-Westphalia, Germany",NA,"Herford, North Rhine-Westphalia, Germany",NA,"Mülheim, North Rhine-Westphalia, Germany",NA,"Herne, North Rhine-Westphalia, Germany",NA,"Neumünster, Schleswig-Holstein, Germany",NA,"Langenhagen, Lower Saxony, Germany",NA,"Erding, Bavaria, Germany",NA,"Leverkusen, North Rhine-Westphalia, Germany",coronavirus bawü,"Troisdorf, North Rhine-Westphalia, Germany",NA,"Mülheim, North Rhine-Westphalia, Germany",NA,"Meerbusch, North Rhine-Westphalia, Germany",NA,"Reutlingen, Baden-Württemberg, Germany",NA,"Willich, North Rhine-Westphalia, Germany",NA,"Bremerhaven, Bremen, Germany",NA,"Bochum, North Rhine-Westphalia, Germany",NA,"Krefeld, North Rhine-Westphalia, Germany",NA,"Brandenburg, Brandenburg, Germany",NA,"Witten, North Rhine-Westphalia, Germany",NA,"Menden, North Rhine-Westphalia, Germany",NA,"Görlitz, Saxony, Germany",NA,"Rodgau, Hesse, Germany",NA,"Heilbronn, Baden-Württemberg, Germany",NA,"Vaihingen an der Enz, Baden-Württemberg, Germany",NA,"Neuwied, Rhineland-Palatinate, Germany",NA,"Reutlingen, Baden-Württemberg, Germany",NA,"Düsseldorf, North Rhine-Westphalia, Germany",NA,"Gelsenkirchen, North Rhine-Westphalia, Germany",NA,"Koblenz, Rhineland-Palatinate, Germany",NA,"Filderstadt, Baden-Württemberg, Germany",NA,"Albstadt, Baden-Württemberg, Germany",NA,"Remscheid, North Rhine-Westphalia, Germany",NA,"Landshut, Bavaria, Germany",NA,"Gütersloh, North Rhine-Westphalia, Germany",NA,"Garbsen, Lower Saxony, Germany",NA,"Herne, North Rhine-Westphalia, Germany",NA,"Böblingen, Baden-Württemberg, Germany",NA,"Göttingen, Lower Saxony, Germany",NA,"Velbert, North Rhine-Westphalia, Germany",NA,"Troisdorf, North Rhine-Westphalia, Germany",NA,"Herdecke, North Rhine-Westphalia, Germany",NA,"Backnang, Baden-Württemberg, Germany",NA,"Lüdenscheid, North Rhine-Westphalia, Germany",NA,"Mülheim, North Rhine-Westphalia, Germany",NA,"Neuwied, Rhineland-Palatinate, Germany",NA,"Göppingen, Baden-Württemberg, Germany",NA,"Lippstadt, North Rhine-Westphalia, Germany",NA,"Kassel, Hesse, Germany",NA,"Worms, Rhineland-Palatinate, Germany",NA,"Rüsselsheim, Hesse, Germany",NA,"Rüsselsheim, Hesse, Germany",NA,"Witten, North Rhine-Westphalia, Germany",NA,"Berlin (Germany), ZZ-ZZZZ, ZZ",NA,"Paderborn, North Rhine-Westphalia, Germany",NA,"Friedrichshafen, Baden-Württemberg, Germany",coronavirus vogtland,"Brandenburg, Brandenburg, Germany",NA,"Chemnitz, Saxony, Germany",NA,"Siegen, North Rhine-Westphalia, Germany",NA,"Gelsenkirchen, North Rhine-Westphalia, Germany",NA,"Willich, North Rhine-Westphalia, Germany",NA,"Friedrichshafen, Baden-Württemberg, Germany",NA,"Schwerte, North Rhine-Westphalia, Germany",NA,"Wolfsburg, Lower Saxony, Germany",NA,"Weimar, Thuringia, Germany",NA,"Berlin (Germany), ZZ-ZZZZ, ZZ",NA
"Passau, Bavaria, Germany",NA,"Wuppertal, North Rhine-Westphalia, Germany",NA,"Gronau, North Rhine-Westphalia, Germany",NA,"Brühl, North Rhine-Westphalia, Germany",NA,"Kehl, Baden-Württemberg, Germany",NA,"Heilbronn, Baden-Württemberg, Germany",NA,"Heilbronn, Baden-Württemberg, Germany",NA,"Erftstadt, North Rhine-Westphalia, Germany",NA,"Langenfeld, North Rhine-Westphalia, Germany",NA,"Delmenhorst, Lower Saxony, Germany",NA,"Aachen, North Rhine-Westphalia, Germany",NA,"Essen, North Rhine-Westphalia, Germany",NA,"Ludwigsburg, Baden-Württemberg, Germany",NA,"Zwickau, Saxony, Germany",NA,"Verden, Lower Saxony, Germany",NA,"Bergisch Gladbach, North Rhine-Westphalia, Germany",NA,"Viersen, North Rhine-Westphalia, Germany",spiegel online,"Aschaffenburg, Bavaria, Germany",NA,"Bremen, Bremen, Germany",NA,"Gütersloh, North Rhine-Westphalia, Germany",NA,"Lüdenscheid, North Rhine-Westphalia, Germany",NA,"Brandenburg, Brandenburg, Germany",NA,"Freising, Bavaria, Germany",NA,"Witten, North Rhine-Westphalia, Germany",NA,"Wetzlar, Hesse, Germany",NA,"Langenfeld, North Rhine-Westphalia, Germany",NA,"Mülheim, North Rhine-Westphalia, Germany",NA,"Rheine, North Rhine-Westphalia, Germany",NA,"Hamm, North Rhine-Westphalia, Germany",söder pressekonferenz heute,"Ahaus, North Rhine-Westphalia, Germany",NA,"Germering, Bavaria, Germany",NA,"Neu-Ulm, Bavaria, Germany",NA,"Moers, North Rhine-Westphalia, Germany",NA,"Gronau, North Rhine-Westphalia, Germany",NA,"Schweinfurt, Bavaria, Germany",NA,"Herford, North Rhine-Westphalia, Germany",NA,"Witten, North Rhine-Westphalia, Germany",NA,"Neunkirchen, Saarland, Germany",NA,"Hamm, North Rhine-Westphalia, Germany",NA,"Gütersloh, North Rhine-Westphalia, Germany",NA,"Tuttlingen, Baden-Württemberg, Germany",NA,"Kaiserslautern, Rhineland-Palatinate, Germany",NA,"Offenburg, Baden-Württemberg, Germany",NA,"Delmenhorst, Lower Saxony, Germany",NA,"Zwickau, Saxony, Germany",NA,"Zwickau, Saxony, Germany",NA,"Bietigheim-Bissingen, Baden-Württemberg, Germany",NA,"Rastatt, Baden-Württemberg, Germany",NA,"Fellbach, Baden-Württemberg, Germany",NA,"Böblingen, Baden-Württemberg, Germany",baden württemberg coronavirus,"Speyer, Rhineland-Palatinate, Germany",NA,"Magdeburg, Saxony-Anhalt, Germany",NA,"Gütersloh, North Rhine-Westphalia, Germany",NA,"Chemnitz, Saxony, Germany",NA,"Schweinfurt, Bavaria, Germany",NA,"Lippstadt, North Rhine-Westphalia, Germany",NA,"Ettlingen, Baden-Württemberg, Germany",NA,"Bochum, North Rhine-Westphalia, Germany",NA,"Bochum, North Rhine-Westphalia, Germany",NA,"Recklinghausen, North Rhine-Westphalia, Germany",NA,"Bad Salzuflen, North Rhine-Westphalia, Germany",NA,"Ratingen, North Rhine-Westphalia, Germany",NA,"Böblingen, Baden-Württemberg, Germany",NA,"Bad Salzuflen, North Rhine-Westphalia, Germany",NA,"Bergisch Gladbach, North Rhine-Westphalia, Germany",NA,"Esslingen, Baden-Württemberg, Germany",NA,"Velbert, North Rhine-Westphalia, Germany",NA,"Bayreuth, Bavaria, Germany",NA,"Kaiserslautern, Rhineland-Palatinate, Germany",NA,"Krefeld, North Rhine-Westphalia, Germany",NA,"Wunstorf, Lower Saxony, Germany",NA,"Heilbronn, Baden-Württemberg, Germany",NA,"Leonberg, Baden-Württemberg, Germany",NA,"Bornheim, North Rhine-Westphalia, Germany",NA,"Neu-Ulm, Bavaria, Germany",NA,"Villingen-Schwenningen, Baden-Württemberg, Germany",NA,"Zwickau, Saxony, Germany",NA,"Wilhelmshaven, Lower Saxony, Germany",NA,"Baden-Baden, Baden-Württemberg, Germany",NA,"Castrop-Rauxel, North Rhine-Westphalia, Germany",NA,"Saarbrücken, Saarland, Germany",NA,"Tübingen, Baden-Württemberg, Germany",NA,"Fulda, Hesse, Germany",NA,"Kirchheim unter Teck, Baden-Württemberg, Germany",NA,"Bochum, North Rhine-Westphalia, Germany",NA,"Kassel, Hesse, Germany",NA,"Ingolstadt, Bavaria, Germany",NA,"Kaiserslautern, Rhineland-Palatinate, Germany",NA,"Heilbronn, Baden-Württemberg, Germany",NA,"Wilhelmshaven, Lower Saxony, Germany",NA,"Brühl, North Rhine-Westphalia, Germany",NA,"Brühl, North Rhine-Westphalia, Germany",NA,"Bergisch Gladbach, North Rhine-Westphalia, Germany",NA,"Gelsenkirchen, North Rhine-Westphalia, Germany",NA,"Kaiserslautern, Rhineland-Palatinate, Germany",NA,"Dachau, Bavaria, Germany",coronavirus in polen,"Lahr, Baden-Württemberg, Germany",NA,"Wunstorf, Lower Saxony, Germany",NA,"Lüdenscheid, North Rhine-Westphalia, Germany",NA,"Kleve, North Rhine-Westphalia, Germany",NA,"Hürth, North Rhine-Westphalia, Germany",NA,"Landshut, Bavaria, Germany",NA,"Landshut, Bavaria, Germany",NA,"Offenburg, Baden-Württemberg, Germany",NA,"Berlin (Germany), ZZ-ZZZZ, ZZ",NA,"Heidelberg, Baden-Württemberg, Germany",NA
